link,headline,category,short_description,authors,date
https://www.huffingtonpost.com/entry/texas-saving-sharks_us_5bb13a25e4b09bbe9a5cc164,Texans Unite in the Fight to Save Sharks,ENVIRONMENT,"100 million sharks are disappearing from our oceans each year, primarily driven by the lucrative trade in shark fins. A bill that would prohibit the sale and consumption of shark fins in Texas, passed the Texas House. However, this bill faces a fight ahead.","Anna M. Clark, Contributor
Founder, EarthPeople Media | Fellow, Hunt Institute of Enginee...",2013-05-19
https://www.huffingtonpost.com/entry/animal-photos-of-the-week_us_5bb13a29e4b09bbe9a5cc22b,"Animal Photos Of The Week: Lemurs, Baboons, Puffins And More",ENVIRONMENT,Some of our favorite animal stories from the last week include: An adorable corgi anthem Good news about sea turtles Some,,2013-05-19
https://www.huffingtonpost.com/entry/global-warming-climate-change-study-2013_us_5bb13a29e4b09bbe9a5cc265,"Climate Change Study Shows Pace Is Slowing, But Extreme Action Still Vital",ENVIRONMENT,"The rate of global warming has slowed after strong rises in the 1980s and 1990s, even though all the 10 warmest years since","Reuters, Reuters",2013-05-19
https://www.huffingtonpost.comhttp://www.weather.com/video/he-shouldnt-be-alive-36798,VIDEO: He Shouldn't Be Alive!,ENVIRONMENT,Matt Sampson shows us how bad weather effects driving. Read more on weather.com,,2013-05-19
https://www.huffingtonpost.comhttp://www.weather.com/news/science/nature/places-earth-holes-craters-changed-20130514,"By Man Or Nature, Places That Will Never Be The Same",ENVIRONMENT,If you had any doubts that we're living in a new age called the Anthropocene -- the term geologists have begun to use to,,2013-05-19
https://www.huffingtonpost.com/entry/puppies-with-a-deadly-cas_us_5bb13a26e4b09bbe9a5cc1ca,Puppies With Deadly Case Of Mange Saved By Good Samaritan,ENVIRONMENT,"Demodectic Mange, also called Demodex, is a skin disease caused by tiny mites. Most pups get a few mange mites from their","The Pet Collective, Contributor
Your daily source for cute, funny, informative, and heartwarmi...",2013-05-19
https://www.huffingtonpost.com/entry/sea-butterfly-photos_us_5bb139f2e4b09bbe9a5cc0c5,Sea Butterfly Photos Show Stunning Underwater Biodiversity,ENVIRONMENT,"But while they're still here, take a look at more incredible images of the sea butterflies below: Many pteropods have shells",,2013-05-18
https://www.huffingtonpost.com/entry/national-geographic-traveler-photo-contest_us_5bb13a23e4b09bbe9a5cc133,National Geographic Traveler Photo Contest 2013 Produces Stunning Images,ENVIRONMENT,"The 'National Geographic Traveler' Photo Contest is upon us, and some stunning images have already started to flow in. The",,2013-05-18
https://www.huffingtonpost.com/entry/shark-fin-ban-delaware_us_5bb13a23e4b09bbe9a5cc13b,A Big Move for a Small State -- Delaware Bans Shark Fins,ENVIRONMENT,"The demand for shark fins is what drives almost all shark deaths. Some species may have declined by as much as 97-99 percent in the last 35 years. In other words, as few as one out of 100 may be left of some species.","Francesca Koe, Contributor
Oceans Advocate & Campaign Strategist",2013-05-18
https://www.huffingtonpost.com/entry/wendys-farmworkers_us_5bb13a17e4b09bbe9a5cc120,"Wendy's, What Are You Waiting For?: Calling on the Fast Food Giant to Stand up For Farmworkers",ENVIRONMENT,"Who has freckles, pigtails, and is still holding out from joining the Fair Food Program? If you guessed the fresh-faced mascot of Wendy's, give yourself a gold star.","Anna Lappé, Contributor
Project Director, Real Food Media Project and author of ""Diet ...",2013-05-18
https://www.huffingtonpost.com/entry/climate-change-tornado-intensity_us_5bb13a27e4b09bbe9a5cc1fc,Is Climate Change Increasing Tornado Intensity?,ENVIRONMENT,"But we can't necessarily say the same about tornadoes, at least not yet. The tornado connection to global warming is tenuous",,2013-05-18
https://www.huffingtonpost.com/entry/extremely-happy-animals-video_us_5bb1391ee4b09bbe9a5cb09b,Video Of Happy Animals Captures Pets Enjoying Life,ENVIRONMENT,"Animals just know how to let loose and have a good time. Chasing balls. Running places. Hanging on doors. Hopkin, who also",,2013-05-12
https://www.huffingtonpost.com/entry/extreme-weather-photos_us_5bb1396ee4b09bbe9a5cb68a,Extreme Weather Photos Of The Week,ENVIRONMENT,An incredible lightning strike was captured off the South Rim of the Grand Canyon and tweeted out by the Department of the,,2013-05-12
https://www.huffingtonpost.com/entry/sneaker-males_us_5bb1396fe4b09bbe9a5cb6af,Rise of the Sneaker Males,ENVIRONMENT,"Biology has guaranteed that the energy of youth will erupt with each new generation.  The question is, how should we deal with it?","Terrie Williams, Contributor
Eco-Physiologist",2013-05-12
https://www.huffingtonpost.com/entry/climate-change-habitat-animal-plant_us_5bb13973e4b09bbe9a5cb71e,"Climate Change To Shrink Animal And Plant Habitats Dramatically, Study Forecasts",ENVIRONMENT,About 57 percent of plants and 34 percent of animal species were likely to lose more than half the area with a climate suited,"Reuters, Reuters",2013-05-12
https://www.huffingtonpost.com/entry/handmade-mothers-day-gift_us_5bb13953e4b09bbe9a5cb535,Handmade Mother's Day Gift Ideas (PHOTOS),ENVIRONMENT,From Earth911's Mary Mazzoni: Skip the mall for Mother’s Day this year and give mom something from the heart. For a bit of,,2013-05-12
https://www.huffingtonpost.comhttp://earth911.com/news/2013/04/08/grow-food-small-spaces/,Tips For Growing Food In A Small Space,ENVIRONMENT,"You may be worried that because you have a small yard or even just a front porch, growing your own food is out of reach. Read",,2013-05-12
https://www.huffingtonpost.com/entry/zombie-worms-devour-whale-bone-with-acid_us_5bb1390de4b09bbe9a5caeb3,"'Zombie Worms' Devour Whale Bone With Skeleton-Melting Acid, New Study Finds (PHOTO)",ENVIRONMENT,"Although they're primarily found on whale bone, the worms have also been seen in shark remains and other fish, LiveScience",Nick Visser,2013-05-12
https://www.huffingtonpost.com/entry/emily-deschanel-peta-ad_us_5bb1393be4b09bbe9a5cb2d3,Emily Deschanel's PETA Ad Targets Troubling Dairy Farm Practices (VIDEO),ENVIRONMENT,'Bones' star Emily Deschanel has joined with PETA to highlight controversial practices within the U.S. dairy industry. The,,2013-05-12
https://www.huffingtonpost.com/entry/cicada-sound-audio_us_5bb13932e4b09bbe9a5cb1b6,Cicada Sound Demonstrated In Audio Recording,ENVIRONMENT,The cicadas are coming. Soon. Billions of the red-eyed bugs are expected to swarm the East Coast for six weeks after temperatures,,2013-05-11
https://www.huffingtonpost.com/entry/eco-friendly-green-burial_us_5bb1395fe4b09bbe9a5cb61c,Green Burials Catch On In The U.S.,ENVIRONMENT,"""The biggest hurdle is getting the awareness of these choices and having choices in the proximity of where people are,"" he","Reuters, Reuters",2013-05-11
https://www.huffingtonpost.com/entry/joe-biden-climate-change-rolling-stone_us_5bb1394de4b09bbe9a5cb4b2,Joe Biden Talks Climate Change And Natural Gas In Rolling Stone Interview,ENVIRONMENT,"""Theoretically, it would be nice not to have any carbon fuels,"" he said. ""But natural gas is a hell of a lot less polluting",Nick Visser,2013-05-11
https://www.huffingtonpost.com/entry/easy-mothers-day-gifts-2013_us_5bb1394be4b09bbe9a5cb45f,"Easy Mother's Day Gifts That Are Sentimental, Thoughtful And Nearly Material Free",ENVIRONMENT,"Happy Mother's Day! Shopping for mom can be stressful. Even if she says she doesn't want a present this year, you know your",,2013-05-11
https://www.huffingtonpost.com/entry/keystone-xl-decision-us-official_us_5bb1395fe4b09bbe9a5cb5ed,"Keystone XL Decision May Not Come Until Later In The Year, U.S. Official Says",ENVIRONMENT,BIG REVISIONS NEEDED? By Timothy Gardner It could also set back TransCanada which last month said delays by Washington would,"Reuters, Reuters",2013-05-11
https://www.huffingtonpost.com/entry/sad-mama-cat-who-lost-her_us_5bb13955e4b09bbe9a5cb5ba,Sad Mama Cat Lost Her Litter To Illness; Is Made Whole By Orphaned Kittens That Needed A Mother,ENVIRONMENT,"The story of Mickey the mama cat is a testament to a mother's instinct and love for her children. There are so many stories of pregnant cats and dogs winding up at the shelter, and the horrors all animals, especially vulnerable newborns, face in that environment.","The Pet Collective, Contributor
Your daily source for cute, funny, informative, and heartwarmi...",2013-05-11
https://www.huffingtonpost.com/entry/reuse-paper-cups_us_5bb13880e4b09bbe9a5ca18e,Reuse Paper Cups: How You Can Cut Down On Waste And Upcycle Used Coffee Containers,ENVIRONMENT,"From Networx's Chaya Kurtz: As a New Yorker, the one piece of garbage that I am most likely to acquire and then throw into",,2013-05-05
https://www.huffingtonpost.com/entry/sheep-riding-dog-photo_us_5bb138d6e4b09bbe9a5ca785,Dog Rides Sheep In The Best Photo You Might See All Day,ENVIRONMENT,"This sheep dog isn't really doing its job, but this photo posted to reddit is just so majestic that the duo look perfect",,2013-05-05
https://www.huffingtonpost.comhttp://earth911.com/style/reet-aus-upcycled-clothing/,"Check Out The World's First Mass-Produced, Upcycled Clothing Line",ENVIRONMENT,"In the past, creating upcycled clothing from discarded materials often meant making one-off designs, frequently by hand. Read",,2013-05-05
https://www.huffingtonpost.com/entry/recycle-kitchen-trash-fridge_us_5bb138fae4b09bbe9a5cab50,Recycle Kitchen Trash: Things From Your Fridge You Should Never Throw Away,ENVIRONMENT,"From Earth911's Mary Mazzoni: Americans produce more than 76 million tons of packaging waste every year, and food packaging",,2013-05-05
https://www.huffingtonpost.com/entry/weird-vegetables_us_5bb138f2e4b09bbe9a5caadb,Weird Vegetables You've Probably Never Heard Of (PHOTOS),ENVIRONMENT,From Mother Nature Network's Bryan Nelson: Think you don't like to eat your veggies? Maybe you're just bored with the options,,2013-05-04
https://www.huffingtonpost.comhttp://www.takepart.com/article/2013/05/01/red-tide-kills-record-number-manatees,"Manatees Are Dying In Droves, Florida Says 'Too Bad'",ENVIRONMENT,A record number of endangered manatees are dying in Florida's algae-choked waterways. Read more on TakePart,,2013-05-04
https://www.huffingtonpost.com/entry/renewable-energy-standards_us_5bb138f5e4b09bbe9a5cab41,Renewable Energy Standards Face Challenge From Fossil Fuel Interests,ENVIRONMENT,"Many battles will be fought in the months ahead, with attacks on RES laws most serious in Connecticut, Missouri, Ohio, Pennsylvania",,2013-05-04
https://www.huffingtonpost.com/entry/frac-daddy-kentucky-derby_us_5bb138fae4b09bbe9a5cab59,"Frac Daddy, Horse Owned By Montana Oilmen, To Run In Kentucky Derby",ENVIRONMENT,The natural gas industry will be given some prime advertising at Saturday's Kentucky Derby in the form of a race horse named,,2013-05-04
https://www.huffingtonpost.comhttp://www.mnn.com/health/healthy-spaces/stories/chemicals-pervasive-in-chicago-air,Chemicals Pervasive In Chicago Air,ENVIRONMENT,"On the brink of federal regulatory review, chemicals in deodorants, lotions and conditioners are showing up in Chicago’s",,2013-05-04
https://www.huffingtonpost.com/entry/an-elephant-named-tim-by_us_5bb13896e4b09bbe9a5ca245,An Elephant Named Tim,ENVIRONMENT,"Tim, an exceptionally impressive male elephant, is 43-years-old. Because males wander, Tim has not been seen for weeks. Now he is here, and he is in a heightened breeding condition called musth, dribbling a pungent-scented urine that tells the ladies and the guys alike that he's the man.","Carl Safina, Contributor
President of the Safina Center",2013-04-28
https://www.huffingtonpost.com/entry/the-sound-of-grinding-cru_us_5bb13896e4b09bbe9a5ca260,"The Sound of Grinding, Crunching Metal",ENVIRONMENT,"Each time I looked at him, his mouth was opened but the mystery object was not about to come out.","Myra Sideris, Contributor
Blogger, The Clueless Puppy Owner",2013-04-28
https://www.huffingtonpost.com/entry/animal-photos-of-the-week_us_5bb13896e4b09bbe9a5ca265,"Animal Photos Of The Week: Rhinos, Kudus, Tigers And More Pictures",ENVIRONMENT,Here’s a recap of animal stories and events from the past week: A study recently came out claiming that pet owners share,,2013-04-28
https://www.huffingtonpost.com/entry/extreme-weather-photos_us_5bb13894e4b09bbe9a5ca232,Extreme Weather Photos Of The Week (PHOTOS),ENVIRONMENT,HuffPost editor James Gerken examined some striking connections between climate change and our changing planet. Check out,,2013-04-28
https://www.huffingtonpost.com/entry/us-transportation-almost_us_5bb13876e4b09bbe9a5ca135,U.S. Transportation Remains Almost Entirely Reliant On Oil (VIDEO),ENVIRONMENT,From Face the Facts USA: What does this mean for our C02 emission levels? 93 percent of U.S. transport remains reliant on,,2013-04-28
https://www.huffingtonpost.com/entry/famous-animal-activists_us_5bb13875e4b09bbe9a5ca10b,Famous Animal Activists: Celebrities Who Care About The Creatures Around Them,ENVIRONMENT,From Vetstreet's Margaret Bristol: With all the glitz and glamour that comes out of Tinseltown (not to mention the endless,,2013-04-28
https://www.huffingtonpost.comhttp://thinkprogress.org/immigration/2013/04/26/1925921/mark-zuckerbergs-new-political-group-spending-big-on-ads-supporting-keystone-xl-and-oil-drilling/?mobile=nc,Mark Zuckerberg's New Political Group Spending Big On Ads Supporting Keystone XL And Oil Drilling,ENVIRONMENT,"Mark Zuckerberg’s new political group, which bills itself as a bipartisan entity dedicated to passing immigration reform",,2013-04-27
https://www.huffingtonpost.com/entry/halliburton-in-settlement_us_5bb13882e4b09bbe9a5ca207,Halliburton In Settlement Talks To Control Its Macondo Cement Liabilities,ENVIRONMENT,"At the phase-one trial, Halliburton's cement expert Jesse Gagliano, who was embedded in BP's Houston office in 2010, testified","Susan Buchanan, Contributor
Contributor",2013-04-27
https://www.huffingtonpost.com/entry/food-revolution-summit_us_5bb13881e4b09bbe9a5ca1ab,Monsanto Hates This,ENVIRONMENT,Monsanto and their buddies in big agribusiness might want to dominate the world's food supply. But a growing movement of concerned citizens is getting fed up and fighting back.,"Ocean Robbins, Contributor
Co-founder & CEO, The Food Revolution Network",2013-04-27
https://www.huffingtonpost.comhttp://www.mnn.com/earth-matters/wilderness-resources/blogs/14-amazing-fractals-found-in-nature,14 Amazing Fractals Found In Nature,ENVIRONMENT,"When you think of fractals, you might think of Grateful Dead posters and T-shirts, all pulsating with rainbow colors and",,2013-04-27
https://www.huffingtonpost.com/entry/craig-stanford-planet-without-apes_us_5bb13851e4b09bbe9a5c9f70,"Craig Stanford, 'Planet Without Apes' Author, Says Eco-Tourism Could Save The Primates",ENVIRONMENT,The great apes were heading toward the brink of extinction in East Africa because of human behavior — logging that destroyed,,2013-04-27
https://www.huffingtonpost.com/entry/keystone-xl-oil-sands-health_us_5bb13869e4b09bbe9a5ca0f0,Keystone XL: Oil Sands Health Concerns Rise Downstream Of Expanding Extraction,ENVIRONMENT,"Dr. John O'Connor, who pushed Ladouceur to get lifesaving heart surgery, said such connections are ""ripe for investigation",Lynne Peeples,2013-04-27
https://www.huffingtonpost.com/entry/balancing-dog-jack_us_5bb13876e4b09bbe9a5ca12b,"Balancing Dog, Jack, Can Hold Almost Any Household Object On His Head (PHOTOS)",ENVIRONMENT,"You can't adopt pets based on talent, but if you're looking for a new friend of your own and are ready for the responsibility",,2013-04-27
https://www.huffingtonpost.com/entry/extreme-weather-swings_us_5bb13876e4b09bbe9a5ca162,Extreme Weather Swings From Record Drought To Flood May Be Sign Of Climate Change,ENVIRONMENT,"Climate studies have warned us to expect more frequent and intense extreme events, such as heavy rain and snow storms, along",,2013-04-27
https://www.huffingtonpost.com/entry/pregnant-dog-abandoned-by_us_5bb13876e4b09bbe9a5ca11d,Pregnant Dog Abandoned By Her Owners At The Shelter Is Saved,ENVIRONMENT,"There is no harder lesson about spaying and neutering your dog than the story of Mimi. Mimi, an unspayed Maltese, suddenly became pregnant. She was only four-years-old when the adorable, white fluffy dog was turned into the shelter.","The Pet Collective, Contributor
Your daily source for cute, funny, informative, and heartwarmi...",2013-04-27
https://www.huffingtonpost.com/entry/london-marathon-rhino-runners_us_5bb1387de4b09bbe9a5ca17e,London Marathon Rhino Runners Wear 22-Pound Suits During Race To Save The Species (PHOTOS),ENVIRONMENT,The suits have become a symbol for the organization and were first introduced in 1992 at the London and New York marathons,,2013-04-27
https://www.huffingtonpost.com/entry/wrinkly-dogs_us_5bb137fee4b09bbe9a5c94e1,"Wrinkly Dogs Make For Adorable Pets, But More Skin Calls For More Love",ENVIRONMENT,"Sharing your home with one of these dogs isn't all fun and games, though. You'll need to wash their deep skin folds with",,2013-04-21
https://www.huffingtonpost.com/entry/animal-photos-of-the-week_us_5bb13811e4b09bbe9a5c987a,"Animal Photos Of The Week: Baby Lemurs, Pandas, Giraffes And More Pictures",ENVIRONMENT,Here’s a recap of animal stories and events from the past week: An Elephant Sanctuary handler was trampled to death in South,,2013-04-21
https://www.huffingtonpost.com/entry/familys-community-garden_us_5bb13806e4b09bbe9a5c96bd,Family's Community Garden Time-Lapse Will Drive You To The Nursery (VIDEO),ENVIRONMENT,"After watching the four-minute video, it looks like they were pretty successful, growing everything from kale and strawberries",,2013-04-21
https://www.huffingtonpost.com/entry/marijuanamerica-book_us_5bb1365ee4b09bbe9a5c7a2b,Marijuanamerica: Why America Loves Weed,ENVIRONMENT,"Just as Prohibition did little to stem the flow of alcohol into Americans' gullets, its repeal did little to resolve the problems that alcohol abuse bestows upon our collective psyche. Which is why, when I think about the future of marijuana in this country, it is with a devil on one shoulder, and an angel on the other.","Alfred Ryan Nerz, Contributor
Author, 'Marijuanamerica: One Man's Quest to Understand Americ...",2013-04-20
https://www.huffingtonpost.com/entry/found-wandering-alone-wit_us_5bb137fee4b09bbe9a5c94fd,"Found Wandering Alone With a Badly Broken Leg, Augie Finds His Perfect Home",ENVIRONMENT,"Who knows how Augie got there, but there he was. Found wandering through an orchard with a broken leg, and no identification. How had he become separated from his home? When had he been hit by the car that broke his leg? How long had he been wandering around in this pain?","The Pet Collective, Contributor
Your daily source for cute, funny, informative, and heartwarmi...",2013-04-20
https://www.huffingtonpost.com/entry/bp-poll_us_5bb137fee4b09bbe9a5c950e,Poll Finds BP Public Image Still Tarnished 3 Years After Gulf Spill,ENVIRONMENT,It's unclear to what extent those opinions were formed by viewing BP's ads. Respondents who said they had seen the ads were,Emily Swanson,2013-04-20
https://www.huffingtonpost.com/entry/clean-with-baking-soda_us_5bb137e2e4b09bbe9a5c92f5,Clean With Baking Soda: How To Replace Nearly All Household Chemicals,ENVIRONMENT,From Networx' Chaya Kurtz: What's not to like about baking soda? It's cheap. It's available in every regular supermarket,,2013-04-20
https://www.huffingtonpost.com/entry/gulf-spill-trials-first-a_us_5bb1380be4b09bbe9a5c9773,Gulf Spill Trial's First Act Ends As BP Rests Its Case,ENVIRONMENT,"On Tuesday, environmentalists and community advocates protested outside U.S. District Court on Poydras St. to mark the third","Susan Buchanan, Contributor
Contributor",2013-04-20
https://www.huffingtonpost.com/entry/why-were-celebrating-enda_us_5bb13808e4b09bbe9a5c970a,Why We're Celebrating Endangered Foods for Earth Day,ENVIRONMENT,"Climate change isn't just this storm gathering way down the road, it's here and it's affecting some of our favorite foods.","Maisie Ganzler, Contributor
Chief Strategy and Brand Officer, Bon Appetit Management Company",2013-04-20
https://www.huffingtonpost.com/entry/earth-day-lessons_us_5bb13809e4b09bbe9a5c971c,Earth Day Lessons,ENVIRONMENT,"In short, Earth Day participants not only get alot done, they also demonstrate that human beings everywhere are driven by their faith, their conscience, their sense of duty, or by a moral imperative to save the planet. It is staggering to think about one billion people working together in a collective action.","Kathleen Rogers, Contributor
President, Earth Day Network",2013-04-20
https://www.huffingtonpost.com/entry/the-environmental-impacts-of-marijuana_us_5bb13807e4b09bbe9a5c96d8,The Environmental Impacts Of An Unregulated Marijuana Industry,ENVIRONMENT,A report released in 2011 (and updated in 2012) estimated that indoor marijuana production may account for 1 percent of the,Nick Visser,2013-04-20
https://www.huffingtonpost.com/entry/gulf-oil-spill-anniversary_us_5bb13808e4b09bbe9a5c96f0,"Gulf Oil Spill Anniversary: 3 Years Later, Ramifications Are Still Felt From BP's Tragedy",ENVIRONMENT,"Although BP already pled guilty to 14 federal criminal charges, including lying to Congress, and agreed to a $4.5 billion",Jessica Leader,2013-04-20
https://www.huffingtonpost.com/entry/extreme-weather-photos_us_5bb13785e4b09bbe9a5c8d3e,Extreme Weather Photos Of The Week,ENVIRONMENT,"That included tornadoes in Arkansas, Alabama and Mississippi, which left thousands without power and were responsible for",,2013-04-14
https://www.huffingtonpost.com/entry/short-lived-climate-pollutants_us_5bb13786e4b09bbe9a5c8d56,"Short-Lived Climate Pollutants Reduction Might Slow Down Sea Level Rise, New Study Shows",ENVIRONMENT,"Already, sea level rise has made storm surge events more damaging than they otherwise would have been. In New York, for example",,2013-04-14
https://www.huffingtonpost.com/entry/female-ulidiid-flies-sperm_us_5bb1377be4b09bbe9a5c8d25,"Female Ulidiid Flies Expel Sperm And Eat It, New Study Shows",ENVIRONMENT,"Follow Tanya Lewis on Twitter and Google+. Follow us @livescience, Facebook & Google+. Original article on LiveScience.com",,2013-04-14
https://www.huffingtonpost.com/entry/cape-cod-seals-photos-pictures-2013_us_5bb136e2e4b09bbe9a5c85e5,Cape Cod Seals Photos Show Them Soaking Up Sun On The Monomoy National Wildlife Refuge Beach,ENVIRONMENT,"Do you find these seals adorable or hazardous? Check out these stunning images, and let us know in the comments below! Humans",,2013-04-14
https://www.huffingtonpost.com/entry/bear-brain-surgery-first-procedure-champa_us_5bb1376fe4b09bbe9a5c8bff,Bear Brain Surgery: First-Ever Cranial Procedure Performed On Asiatic Black Bear (PHOTOS),ENVIRONMENT,"Free the Bears, which runs the sanctuary, decided to take the chance and enlisted a renowned veterinary surgeon for the operation",Sara Gates,2013-04-13
https://www.huffingtonpost.com/entry/rhino-poaching-india-wwf_us_5bb136f1e4b09bbe9a5c8722,Rhino Poaching In India Orphans Baby Months After Mother Moved To National Park (PHOTOS),ENVIRONMENT,"Take a look at some photos of the rhino family from late March, as well as photos of the recently-orphaned calf, below. The",,2013-04-13
https://www.huffingtonpost.com/entry/the-hoax_us_5bb13770e4b09bbe9a5c8c36,The 'Hoax',ENVIRONMENT,"Do we agree with Senator Inhofe that global warming is a ""hoax"" and that we do not want the federal government to address that issue? Or do we agree with the overwhelming majority of scientists who tell us that that we must act boldly and aggressively to protect the future of this planet?","Sen. Bernie Sanders, Contributor
U.S. Senator from Vermont",2013-04-13
https://www.huffingtonpost.com/entry/8-ways-that-california-an_us_5bb13776e4b09bbe9a5c8c8e,8 Ways That California and China Can Work Together to Reduce Pollution and Protect the Climate,ENVIRONMENT,China has made significant progress in energy efficiency but still requires twice as much energy to produce one unit of GDP as the world average. Enormous opportunities still remain in both California and China to save energy more cheaply than it can be produced.,"Barbara Finamore, Contributor
Senior Attorney and Asia Director, Natural Resources Defense C...",2013-04-13
https://www.huffingtonpost.com/entry/exxon-arkansas-spill_us_5bb13775e4b09bbe9a5c8c6f,Exxon On Arkansas Spill: Animals Impacted 'Primarily Venomous Snakes',ENVIRONMENT,"Roughly two weeks after Exxon's Pegasus pipeline ruptured in Mayflower, Ark., spilling an estimated 84,000 gallons of crude",Lucia Graves,2013-04-13
https://www.huffingtonpost.com/entry/abused-dog-keeps-running_us_5bb1374be4b09bbe9a5c8a68,Abused Dog Keeps Running Away From Home and Finally Finds Help,ENVIRONMENT,"Meet Emerson, an adorably sweet little Papillion/Pomeranian mix. You'd never guess the struggles this tiny guy has faced by looking at him now, but little Emerson is a fighter and a survivor. This is where Emerson's story begins.","The Pet Collective, Contributor
Your daily source for cute, funny, informative, and heartwarmi...",2013-04-13
https://www.huffingtonpost.com/entry/beautiful-images-from-around-world-photos_us_5bb1348be4b09bbe9a5c5959,Beautiful Images From Around The World (PHOTOS),ENVIRONMENT,"Isn't the world beautiful? While all this talk about fracking, climate change and tar sands is incredibly important, sometimes",,2013-04-13
