link,headline,category,short_description,authors,date
https://www.huffingtonpost.com/entry/un-climate-talks-deadlocked_us_5bb147aae4b09bbe9a5de625,UN Climate Talks Limp Toward Global Deal In 2015,ENVIRONMENT,"Environmentalists walked out on Thursday, exasperated by lack of progress. Rich nations are preoccupied with reviving their","Reuters, Reuters",2013-11-23
https://www.huffingtonpost.com/entry/warsaw-to-world-leaders-y_us_5bb147ace4b09bbe9a5de668,Warsaw to World Leaders: You Have Your Work Cut Out for You,ENVIRONMENT,There is already ample evidence that humanity isn't acting quickly enough to address climate change. The need for greater action in 2015 is obvious. And there are plenty of reasons to believe that countries can get their act together by then.,"Jake Schmidt, Contributor
International Program Director, Natural Resources Defense Council",2013-11-23
https://www.huffingtonpost.com/entry/amidst-typhoons-and-clima_us_5bb147ace4b09bbe9a5de687,"Amidst Typhoons and Climate Change, U.S. Spying Network Shows Contempt for Environment",ENVIRONMENT,"Despite mounting evidence that global warming is leading to devastating environmental disasters in the Pacific region, the U.S. and its partners are suspicious of climate change advocates. Rather brazenly, Washington and its Pacific allies spy on those who are intent on reining in global warming.","Nikolas Kozloff, Contributor
New York-based political writer and photographer.",2013-11-23
https://www.huffingtonpost.comhttp://www.mnn.com/lifestyle/responsible-living/stories/helium-too-precious-for-party-balloons-says-chemist,"Helium Too Precious For Party Balloons, Says Chemist",ENVIRONMENT,I was in the grocery store the other day when my children started to pester me for a balloon. Read more on Mother Nature,,2013-11-23
https://www.huffingtonpost.com/entry/irreplaceable-places_us_5bb147a4e4b09bbe9a5de54a,"Scientists Identify More Than 2,300 'Irreplaceable' Places Key To Wildlife's Survival",ENVIRONMENT,"Sian Ka'an Biosphere Reserve, Mexico Khao Sok National Park, Thailand Sierra Nevada de Santa Marta Natural National Park",,2013-11-23
https://www.huffingtonpost.com/entry/nature-conservancy-photo-contest_us_5bb147a9e4b09bbe9a5de5b6,"The Nature Conservancy Photo Contest Finals Are Here, And They Are Absolutely Beautiful",ENVIRONMENT,"Take a look at the shots below, and then head over the contest's website between now and December 23 to vote. The world really",,2013-11-23
https://www.huffingtonpost.com/entry/environment-facts_us_5bb1474ee4b09bbe9a5de278,13 Awe-Inspiring Facts About The Environment,ENVIRONMENT,"You already know the basics: Climate change is a real and imminent threat, fracking has more to it than meets the eye and",Liat Kornowski,2013-11-23
https://www.huffingtonpost.com/entry/illinois-tornado-storms_us_5bb14718e4b09bbe9a5dd979,Illinois Tornado Wreaks Havoc Near Peoria,ENVIRONMENT,"Many of the injuries appeared to have been caused by collapsing structures. CHICAGO, Nov 17 (Reuters) - A fast-moving storm","Reuters, Reuters",2013-11-17
https://www.huffingtonpost.com/entry/kauai-gmo-protests_us_5bb14718e4b09bbe9a5dd992,A Look Back At The Kauai GMO Protests,ENVIRONMENT,"It is expected that the biotech companies will challenge the law in court. As seen above, there's no doubt Kauai will be",,2013-11-17
https://www.huffingtonpost.com/entry/haiyan-global-warming_us_5bb146c5e4b09bbe9a5dd899,Super Typhoon Haiyan: Realities of a Warmed World,ENVIRONMENT,Satellite images along with readings of ocean heat seem to suggest that Haiyan was an unnaturally powerful storm. The science is hinting that this storm may not have been so catastrophic in a world without warming.,"Michael E. Mann, Contributor
Director of Penn State Earth System Science Center; Author of ...",2013-11-17
https://www.huffingtonpost.com/entry/kauai-county-council-override_us_5bb146c6e4b09bbe9a5dd8a3,Kauai County Council Override Frees Way For GMO Bill,ENVIRONMENT,Today the Council voted to override the veto by a count of 5-2. Mayor Carvalho left before the vote took place. CORRECTION,,2013-11-17
https://www.huffingtonpost.com/entry/animal-photos_us_5bb146d9e4b09bbe9a5dd929,Animal Photos Of The Week: Baby Zebra Greets The World,ENVIRONMENT,Some of the most popular animal stories from the last week include: China is considering new rules that would ease animal,,2013-11-17
https://www.huffingtonpost.com/entry/rabbit-eating-in-slow-motion_us_5bb146bee4b09bbe9a5dd794,This Rabbit Eating In Slow Motion Is Absolutely Enthralling (VIDEO),ENVIRONMENT,"Beans the rabbit likes to munch on parsley, and we like to watch Beans munch in super slow motion... Because everything is",Sarah Barness,2013-11-17
https://www.huffingtonpost.com/entry/peccary-pup-zoo_us_5bb146bae4b09bbe9a5dd726,Peccary Pups At San Francisco Zoo Are The Cutest Things You've Never Heard Of,ENVIRONMENT,(Photo courtesy of the San Francisco Zoo) Check out pictures of the peccary pups below: The San Francisco Zoo just welcomed,Lydia O'Connor,2013-11-17
https://www.huffingtonpost.com/entry/thousands-march-outside-t_us_5bb146c5e4b09bbe9a5dd867,"Thousands March Outside the UN Climate Talks in Warsaw, Poland",ENVIRONMENT,Thousands of people from around the world took the streets outside the UN Climate Talks in Warsaw today to demand climate justice.,"Jamie Henn, Contributor
Co-founder and Strategic Communications Director, 350.org and ...",2013-11-16
https://www.huffingtonpost.com/entry/obama-us-oil-production_us_5bb146c5e4b09bbe9a5dd878,Obama Praises U.S. Oil Production As 'Tremendous Step Towards American Energy Independence',ENVIRONMENT,"""Between more clean energy and less wasted energy, our emissions of dangerous carbon pollution are actually falling,"" Obama","Reuters, Reuters",2013-11-16
https://www.huffingtonpost.com/entry/kauai-county-council-override_us_5bb146c5e4b09bbe9a5dd88a,New Member Could Tip Balance On Kauai County Council On Pesticide Bill,ENVIRONMENT,But Friday's council election wasn't a referendum on Bill 2491. Kualii told Civil Beat that he strongly supported overriding,Gabriela Aoun,2013-11-16
https://www.huffingtonpost.com/entry/day-of-shame-michigan-wol_us_5bb146bae4b09bbe9a5dd738,Day of Shame: Michigan Wolf Slaughter Commences,ENVIRONMENT,Today is a shameful day in Michigan history. This morning 1200 hunters are out with high-powered rifles trying to kill forty-three wolves. And for what? Nothing but bloodlust.,"Jeff Gibbs, Contributor
Documentary filmmaker",2013-11-16
https://www.huffingtonpost.com/entry/animal-photos-of-the-week_us_5bb1465ce4b09bbe9a5dce4e,Animal Photos Of The Week: Baby Tiger Goes For A Swim,ENVIRONMENT,Some of the most popular animal stories from the last week include: Nearly 500 protected turtles were confiscated at a Thai,,2013-11-10
https://www.huffingtonpost.com/entry/want-to-win-the-climate-d_us_5bb1465de4b09bbe9a5dce69,Want to Win the Climate Debate? Stop Debating.,ENVIRONMENT,"The deniers do not care that 97 percent of scientists agree that climate change is anthropogenic because only 97 percent of scientists agree, not 100 percent. Even with mass consensus, there are still those three percent and those three percent are key to legitimizing the debate.","Lucy Emerson-Bell, Contributor
Masters Candidate at the Yale School of Forestry and Environme...",2013-11-10
https://www.huffingtonpost.com/entry/un-climate-talks_us_5bb1465de4b09bbe9a5dce96,UN Climate Talks May Only Bring Moderate Progress As Rich Nations Worry About Economy,ENVIRONMENT,"""We need flexibility between the countries, that they will promote their own strategies, their own goals,"" Environment Minister","Reuters, Reuters",2013-11-10
https://www.huffingtonpost.com/entry/labrador-with-skin-infection_us_5bb14632e4b09bbe9a5dccc1,Labrador With Skin Infection Slowly Recovers,ENVIRONMENT,Do you have a Tail of Hope or Survival? We'd love to hear it! Visit us at thepetcollective.tv and tell us your story! Share,"The Pet Collective, Contributor
Your daily source for cute, funny, informative, and heartwarmi...",2013-11-10
https://www.huffingtonpost.com/entry/zoo-animals-pumpkins_us_5bb14640e4b09bbe9a5dcd21,"Zoo Animals Eating Pumpkins Is The Best Thing You'll See This Weekend (PHOTOS, VIDEO)",ENVIRONMENT,Humans aren't the only ones who enjoy a seasonal treat. California's Oakland Zoo has partnered with local pumpkin patches,Lydia O'Connor,2013-11-10
https://www.huffingtonpost.com/entry/hawaii-invasive-species_us_5bb1462fe4b09bbe9a5dcb67,"Hawaii's Invasive Species Might Be Cute, But They're A Huge Island Threat",ENVIRONMENT,"Coqui Wanted for: Excessive loud noise, overpopulation, disrupting billionaire Larry Ellison's fantasy island. Take the giant",Carla Herreria,2013-11-09
https://www.huffingtonpost.com/entry/eagle-scout-airport-raptor_us_5bb14632e4b09bbe9a5dccd3,Government To Use Eagle Scout's Raptor Trap At Airports,ENVIRONMENT,Bird collisions are a safety concern for planes and passengers as well. The Federal Aviation Administration reports that,Lydia O'Connor,2013-11-09
https://www.huffingtonpost.com/entry/smart-wheel-flykly_us_5bb14646e4b09bbe9a5dcd85,Smart Wheel By FlyKly Could Change Everything About Commuting,ENVIRONMENT,"So FlyKly’s Niko Klansek decided to “turn an ordinary bike into a smart bike.” Before setting out on a ride, the cyclist",Gabriela Aoun,2013-11-09
https://www.huffingtonpost.comhttp://www.mnn.com/leaderboard/stories/teen-wows-science-fair-with-body-heat-powered-flashlight,Teen Wows Science Fair With Body-Heat Powered Flashlight,ENVIRONMENT,"The next time you go camping, don't worry about batteries or an outlet to power your flashlight. If you have a model designed",,2013-11-09
https://www.huffingtonpost.com/entry/electric-school-bus_us_5bb14633e4b09bbe9a5dcd11,An Electric School Bus Could Be Coming To A School Near You,ENVIRONMENT,"From Mother Nature Network's Russell McLendon: American school buses have long run on diesel, pumping out toxic exhaust around",,2013-11-09
https://www.huffingtonpost.com/entry/landscape-photographer-of-the-year_us_5bb145e0e4b09bbe9a5dc142,Landscape Photographer Of The Year Awards Showcase The UK's Stunning Beauty,ENVIRONMENT,"Sometimes, a picture really is worth a thousand words. City Twilight, London, England by Charlotte Gilliatt – Runner-up, Urban",,2013-11-03
https://www.huffingtonpost.com/entry/autumn-dispatch-from-the_us_5bb145e1e4b09bbe9a5dc17f,Autumn Dispatch From the Hills and Hollers of West Virginia,ENVIRONMENT,The past month has been fairly busy for me and my work fighting against the coal industry.,"Junior Walk, Contributor
Activist",2013-11-03
https://www.huffingtonpost.com/entry/rules-of-the-road-needed_us_5bb145e2e4b09bbe9a5dc1d7,Rules of the Road Needed for North American Energy,ENVIRONMENT,"With new North American resource abundance, we have the opportunity to better control our destiny and move to greater independence. But we cannot hope to do that without a robust integrated North American energy marketplace.","Denise Bode, Contributor
National energy policy expert and former Chairman of the Oklah...",2013-11-03
https://www.huffingtonpost.com/entry/oil-gas-talking-points-st_us_5bb145e1e4b09bbe9a5dc18d,Oil & Gas Talking Points Start to Unravel,ENVIRONMENT,Colorado Public Radio's Ryan Warner and ProPublica's Abrahm Lustgarten fact checked a new set of ads sponsored by Coloradans for Responsible Energy Developments. The results of their analysis dealt a blow to oil and gas advocates.,"Trevor Kincaid, Contributor
Center for Western Priorities",2013-11-03
https://www.huffingtonpost.com/entry/cheetah-licks-gopro_us_5bb145e0e4b09bbe9a5dc0f9,Why Did The Cheetah Lick The GoPro Camera?,ENVIRONMENT,"We have for you an accidental, but absolutely amazing moment captured on camera that is sure to make you smile today: an",William Goodman,2013-11-03
https://www.huffingtonpost.com/entry/animal-photos_us_5bb14604e4b09bbe9a5dc38d,Animal Photos Of The Week,ENVIRONMENT,Some of the most popular animal stories from the last week include: Climate change is harming wolf populations in Northern,,2013-11-03
https://www.huffingtonpost.com/entry/the-digital-life_us_5bb14605e4b09bbe9a5dc396,The Digital Life,ENVIRONMENT,"Discoveries of how technology and humans really interact are being made every day, leading one to the conclusion that it's not an unimaginable future -- and it may be the key to sustainable living on an increasingly overcrowded planet.","Terry Tamminen, Contributor
CEO. Leonardo DiCaprio Foundation",2013-11-03
https://www.huffingtonpost.com/entry/shrimp-parasite_us_5bb145e9e4b09bbe9a5dc350,"Shrimp Parasite Causing Mass Die-Off In Georgia, South Carolina As Black Gill Disease Spreads",ENVIRONMENT,"Georgia shrimpers have caught fewer than half the number they usually catch in August, September and October, said Patrick","Reuters, Reuters",2013-11-03
https://www.huffingtonpost.com/entry/extreme-weather-photos_us_5bb145f7e4b09bbe9a5dc37b,Extreme Weather Photos Of The Week,ENVIRONMENT,"This week brought several big headlines in extreme weather news: One year later, residents remembered the lasting impact",,2013-11-03
https://www.huffingtonpost.com/entry/protecting-rivers-reducin_us_5bb145e2e4b09bbe9a5dc1f4,"Protecting Rivers, Reducing Climate Vulnerability",ENVIRONMENT,"Climate change is water change. Learning from earlier flood disasters and preparing for climate change, governments, scientists and environmental organizations have started to remove levees and recreate floodplains on rivers such as the Rhine, the lower Yangtze and the lower Danube.","Peter Bosshard, Contributor
Finance Program Director, The Sunrise Project",2013-11-02
https://www.huffingtonpost.com/entry/frack-check-video-debunks_us_5bb145dbe4b09bbe9a5dbff5,'Frack Check' Videos Blast Claims Made By Colorado Oil And Gas Industry,ENVIRONMENT,"Last year when Hickenlooper was invited to give the keynote address at The Atlantic's Next Generation Energy Forum, he vigorously",Matt Ferner,2013-11-02
https://www.huffingtonpost.comhttp://www.mnn.com/family/protection-safety/stories/squirrelus-interruptus-5-things-shut-down-by-squirrels,Squirrelus Interruptus: 5 Things Shut Down By Squirrels,ENVIRONMENT,What does it take to bring a nuclear weapons site to its knees? Read on ... Read more on Mother Nature Network,,2013-11-02
https://www.huffingtonpost.com/entry/white-nose-syndrome-fungus_us_5bb145e2e4b09bbe9a5dc1ce,"White Nose Syndrome, Bat-Killing Fungus, Is All But Invincible, Study Finds",ENVIRONMENT,A map showing the spread of white-nose syndrome since 2006. (Image: whitenosesyndrome.org) Heat is one of the few silver,,2013-11-02
https://www.huffingtonpost.com/entry/kauai-mayor-gmo-bill_us_5bb145e6e4b09bbe9a5dc2c4,Did Mayor Undermine Kauai Council's Legal Fight Against Biotech Giants?,ENVIRONMENT,"The ""county attorney's office concludes that there are many legal challenges facing Bill 2491,"" writes Trask. He garnered",Gabriela Aoun,2013-11-02
https://www.huffingtonpost.com/entry/huge-surf-north-shore_us_5bb145d5e4b09bbe9a5dbd3b,Huge Surf On North Shore Of Oahu Shows You Don't Have To Go To Nazaré To See Nature's Fury,ENVIRONMENT,"A possibly 100-foot wave off Nazaré, Portugal made headlines on Monday when two Brazilian surfers squared off against the",Gabriela Aoun,2013-11-02
https://www.huffingtonpost.com/entry/kittens-puppies-slow-motion_us_5bb14554e4b09bbe9a5db65b,Kittens And Puppies In Slow Motion Are Too Cute For Words (VIDEO),ENVIRONMENT,"In what can only be described as a total coincidence with the previous statement, we happen to have for you -- wait for it",William Goodman,2013-10-27
https://www.huffingtonpost.com/entry/the-trail-of-the-whales-l_us_5bb1455de4b09bbe9a5db7ec,The Trail of the Whales: Look How Far We've Come,ENVIRONMENT,"We've nearly made it to the end of our journey. My toddler and I have been following the grey whale migration up the west coast of the Americas. I pieced the journey together using public transport, on a tight budget and tight schedule.","Doreen Walton, Contributor
Writer, science journalist, mother and whale nerd",2013-10-27
https://www.huffingtonpost.com/entry/goat-makes-a-break-for-it_us_5bb1455ce4b09bbe9a5db75a,An Escape Goat Makes A Grand Getaway,ENVIRONMENT,"There's a whole wide-world out there, and this little goat cannot be contained. Watch him take a leap of faith out of his",Sarah Barness,2013-10-27
https://www.huffingtonpost.com/entry/animal-photos-of-the-week_us_5bb14582e4b09bbe9a5db82a,Animal Photos Of The Week: Time For Animal Halloween,ENVIRONMENT,Some of the most popular animal stories from the last week include: Indonesia's capital banned monkey street performances,,2013-10-27
https://www.huffingtonpost.com/entry/brown-university-coal_us_5bb14583e4b09bbe9a5db839,Brown University's Misguided Vote to Not Divest From Coal,ENVIRONMENT,"Today, on the anniversary of Hurricane Sandy, Brown University defied the will of its student body and its own investment advisory committee and voted not to divest from the 15 largest U.S. coal companies.","Jamie Henn, Contributor
Co-founder and Strategic Communications Director, 350.org and ...",2013-10-27
https://www.huffingtonpost.com/entry/the-war-against-wolves-wi_us_5bb1455de4b09bbe9a5db801,The War Against Wolves and Wildlife: Time to Stop the Killing,ENVIRONMENT,"What is perhaps most disquieting about the photograph is the vigilante feel that echoes a lynch mob -- dehumanize, vilify, and murder. Wolves are now reviled and persecuted in a land where they once roamed wild and free prior to European colonization.","Camilla Fox, Contributor
Executive Director, Project Coyote",2013-10-27
https://www.huffingtonpost.com/entry/extreme-weather-photos_us_5bb1456de4b09bbe9a5db815,Extreme Weather Photos Of The Week,ENVIRONMENT,This week brought several big headlines in extreme weather news: Hurricane Raymond forced hundreds in Mexico to evacuate,,2013-10-27
https://www.huffingtonpost.com/entry/chemical-sensitivity-fragrance-church_us_5bb14554e4b09bbe9a5db6a4,Chemically Sensitive Find Sanctuary In Fragrance-Free Churches,ENVIRONMENT,"Ohio State's Heimlich agreed that churches are key venues for environmental progress. ""There are people out there who would",Lynne Peeples,2013-10-26
https://www.huffingtonpost.com/entry/dog-loses-leg_us_5bb1455ce4b09bbe9a5db783,Dog Loses Leg But Not His Love For Life,ENVIRONMENT,"An Orange County based rescue, pulled Leo from the shelter and had their own veterinarian look at him, they realized the truth was much worse than a broken bone. Leo had been shot twice. The bone was shattered.","The Pet Collective, Contributor
Your daily source for cute, funny, informative, and heartwarmi...",2013-10-26
https://www.huffingtonpost.com/entry/whale-carcass-hawaii_us_5bb1455ce4b09bbe9a5db78a,"Giant, Floating Whale Carcass Could Attract Sharks Close To Hawaii Shore",ENVIRONMENT,"The 30-40 foot sperm whale carcass currently floating off Oahu's windward shore ""kind of looked like Swiss cheese,"" according",,2013-10-26
https://www.huffingtonpost.com/entry/crazy-ants-gulf-coast_us_5bb1455ce4b09bbe9a5db7b0,"'Crazy Ants' Spreading Throughout Gulf Coast, Defying Extermination",ENVIRONMENT,"""You almost have to see it to believe what a nuisance these can become,"" said Robert Puckett, an associate research scientist","Reuters, Reuters",2013-10-26
https://www.huffingtonpost.com/entry/bulldog-compilation_us_5bb14509e4b09bbe9a5dac48,Bulldogs Being Bulldogs Compilation Is Exactly What You Want It To Be,ENVIRONMENT,"Here is a compilation of not one, not two, not three, but thousands of bulldogs being adorable. Okay, maybe not thousands",Sarah Barness,2013-10-20
https://www.huffingtonpost.com/entry/animal-photos_us_5bb14532e4b09bbe9a5dad9b,"Animal Photos Of The Week: Wolves, Giraffes And Baby Dolphins",ENVIRONMENT,Some of the most popular animal stories from the last week include: Grumpy Cat won a lifetime achievement award. Incredible,,2013-10-20
https://www.huffingtonpost.com/entry/columbia-college-fossil-fuel-divestment_us_5bb1450ce4b09bbe9a5dacdc,"In First Vote, Columbia College Students Back Fossil Fuel Divestment",ENVIRONMENT,"""We demand that Columbia and Barnard immediately freeze any new investment in the 200 publicly traded fossil fuel companies currently holding the vast majority of the world's proven coal, oil and gas reserves,"" the initiative read in part.","John V. Santore, Contributor
Freelance Reporter",2013-10-20
https://www.huffingtonpost.com/entry/natural-gas-from-cows_us_5bb1450fe4b09bbe9a5dad4f,Natural Gas From Cows? Argentine Scientists Tap Methane In Bovine Burps,ENVIRONMENT,"By Maximiliano Rizzi The gases - which otherwise are commonly known as burps, or ""eruptos"" in Spanish - are then processed","Reuters, Reuters",2013-10-20
https://www.huffingtonpost.com/entry/extreme-weather-photos_us_5bb1451ee4b09bbe9a5dad86,Extreme Weather Photos Of The Week,ENVIRONMENT,This week brought several big headlines in extreme weather news: Nearly 100 bushfires raged across Australia. Without a major,,2013-10-20
https://www.huffingtonpost.com/entry/jellyfish-stings-increasing-health_us_5bb14508e4b09bbe9a5dabd4,"Jellyfish Stings An Increasing Public Health Concern, Experts Say",ENVIRONMENT,"""In a lot of respects, issues of blooms are kind of irrelevant,"" said Condon. ""We know we go through rise and fall periods",Lynne Peeples,2013-10-19
https://www.huffingtonpost.comhttp://www.mnn.com/your-home/organic-farming-gardening/blogs/long-island-pumpkin-snatcher-on-the-loose-after-swiping,Long Island Pumpkin Snatcher On The Loose After Swiping 600 Gourds,ENVIRONMENT,"Late last month, the sleepy Long Island hamlet of Calverton was shaken by a most audacious crime: At some point during the",,2013-10-19
https://www.huffingtonpost.com/entry/rachelle-lefevre-car-idling_us_5bb1450be4b09bbe9a5dacb5,"Actress Rachelle Lefevre Takes On Car Idlers, Pollution In Hilarious PSA",ENVIRONMENT,"From Mother Nature Network Guest Columnist Rachelle Lefevre: Growing up in a cold, Canadian climate you get used to morning",,2013-10-19
https://www.huffingtonpost.com/entry/australian-firefighter-go-pro-video-jonathan-mallin-mt-victoria_us_5bb1450ce4b09bbe9a5dace5,Australian Firefighter Captures Terrifying Video Of Bush Fire With Go-Pro Camera,ENVIRONMENT,"By attaching a portable Go-Pro camera to his helmet, firefighter Jonathan Mallin has recorded what it looks like for firefighters",Hunter Stuart,2013-10-19
https://www.huffingtonpost.com/entry/huge-gmo-news_us_5bb1450ce4b09bbe9a5dacf9,Huge GMO News,ENVIRONMENT,"Nobody knows what's going to happen in Washington between now and November 5. But from Mexico, to Hawaii and to the 64 nations that already have GMO labeling, this tide just might be turning.","Ocean Robbins, Contributor
Co-founder & CEO, The Food Revolution Network",2013-10-19
https://www.huffingtonpost.com/entry/platypus-belly-rub_us_5bb144e0e4b09bbe9a5da89e,Little Platypus Loves Her Little Belly Rubbed,ENVIRONMENT,What do you get when you cross a duck with an otter with food and a belly rub? One very blissed out little platypus! Via,Sarah Barness,2013-10-19
https://www.huffingtonpost.comhttp://www.upworthy.com/something-to-keep-in-mind-next-time-youre-thinking-about-ordering-crab-or-lobster,Something To Keep In Mind Next Time You're Thinking About Ordering Crab Or Lobster,ENVIRONMENT,"Whenever I watch PETA videos, I try to imagine myself in the animal's shoes. I will make an exception this time because I",,2013-10-13
https://www.huffingtonpost.com/entry/animal-photos_us_5bb144c1e4b09bbe9a5da349,"Animal Photos Of The Week: Hippos, Wallabies And Bald Eagles",ENVIRONMENT,Some of the most popular animal stories from the last week include: Fat pets are a growing problem in American households,,2013-10-13
https://www.huffingtonpost.com/entry/ubiquitous-plastics-toxic_us_5bb14498e4b09bbe9a5da2f5,"Ubiquitous Plastics, Toxic Sponges Extraordinaire",ENVIRONMENT,"Sadly, my favorite lake in Switzerland Lake Geneva is also full of plastics. And last week scientists from the University","Dr Reese Halter, Contributor
Broadcaster, Biologist",2013-10-13
https://www.huffingtonpost.com/entry/feds-and-bp-clash-over-ba_us_5bb14498e4b09bbe9a5da310,Feds and BP Clash Over Barrels Spilled at Macondo Trial,ENVIRONMENT,"At the Macondo spill trial, number crunching or quantification of the oil flow started Monday in U.S. District Court in New Orleans, with Judge Carl Barbier presiding. The U.S. is on one side with a figure of about 5 million barrels for the disaster that commenced in 2010, versus BP and Anadarko on the other with 3.26 million barrels.","Susan Buchanan, Contributor
Contributor",2013-10-13
https://www.huffingtonpost.comhttp://www.mnn.com/earth-matters/animals/photos/8-superlative-spiders/an-arachnid-pageant,8 Superlative Spiders,ENVIRONMENT,"Autumn brings changing leaves, Halloween ghouls and a burst of activity from one member of the natural world that leaves",,2013-10-13
https://www.huffingtonpost.com/entry/electric-car-charger_us_5bb1448ee4b09bbe9a5da25c,"Electric Car Charger Company, ECOtality, Goes Bankrupt, Stranding 13,000 Docking Stations",ENVIRONMENT,"From Mother Nature Network's Jim Motavalli: Now here’s a fine mess, as Laurel and Hardy used to say. One of the biggest electric",,2013-10-13
https://www.huffingtonpost.com/entry/extreme-weather-photos_us_5bb144abe4b09bbe9a5da330,Extreme Weather Photos Of The Week,ENVIRONMENT,"This week brought several big headlines in extreme weather news: Cyclone Phailin slammed into India, displacing hundreds",,2013-10-13
https://www.huffingtonpost.com/entry/dogs-personhood_us_5bb14486e4b09bbe9a5d9fa6,Corporations Have Personhood. Why Not Dogs? (UPDATED),ENVIRONMENT,"""We already knew that dogs were special,"" he said, adding that we know that they are ""attuned to us,"" as well as being able",Arin Greenwood,2013-10-12
