link,headline,category,short_description,authors,date
https://www.huffingtonpost.com/entry/staten-island-hurricane-sandy_us_5bb12621e4b09bbe9a5b8de2,Staten Island Residents Say Official Hurricane Sandy Response Has Been Slow And Inadequate,ENVIRONMENT,"Frank, along with his wife, daughter and his parents, all fled their home last Sunday afternoon. But on Monday, his parents",Chris Kirkham and Saki Knafo,2012-11-04
https://www.huffingtonpost.com/entry/climate-change-election-2012_us_5bb125cde4b09bbe9a5b853a,The Green Elephant in the Room,ENVIRONMENT,"While Sandy has impacted campaign schedules, she has not yet altered the agenda, let alone the day's talking points.","Betsy Rosenberg, Contributor
Environmental media host/producer, speaker, writer, commentato...",2012-11-03
https://www.huffingtonpost.com/entry/barbi-twins-animal-rescue_us_5bb124a6e4b09bbe9a5b7848,"Move Over, Romney and Obama: The Barbi Twins' 'Green Tea Diploradical Party' Speaks for the Real 99 Percent",ENVIRONMENT,"Shane and Sia Barbi, the animal activists and legendary Playboy celebrities, would like us to understand that humans as a species represent ""the 1 percent,"" with animals and the environment making up the 99 percent.","Joan K. Smith, Contributor
Contributor",2012-11-03
https://www.huffingtonpost.com/entry/are-nuclear-plants-safe-i_us_5bb12603e4b09bbe9a5b8a25,Are Nuclear Plants Safe in Hurricanes? Incident During Sandy Suggests They May Not Be,ENVIRONMENT,"Sandy did not kill hundreds -- as Hurricane Katrina did in New Orleans in 2005 -- thanks, in part, to timely evacuations and rescue efforts. And luckily, it did not trigger an even greater disaster at one of the region's nuclear power plants. But it could have.","Richard Schiffman, Contributor
Journalist",2012-11-03
https://www.huffingtonpost.com/entry/hurricane-sandy-insurance_us_5bb1261be4b09bbe9a5b8cf6,"In Sandy's Wake, Insurance Industry Must Better Account For Climate Change, Critics Say",ENVIRONMENT,"Hartwig added that government subsidized property insurance, like the National Flood Insurance Program or the Citizens Property",Tom Zeller Jr.,2012-11-03
https://www.huffingtonpost.com/entry/noreaster-new-york-new-jersey_us_5bb1261be4b09bbe9a5b8d16,"Nor'easter: New York, New Jersey May Get Hit By Snow Storm Around Election Day",ENVIRONMENT,"The new storm's path is predicted to move from the Southeast Tuesday night into New Jersey on Wednesday, said Brian McNoldy",,2012-11-03
https://www.huffingtonpost.com/entry/climate-change-hurricane-sandy_us_5bb1261de4b09bbe9a5b8d4a,Listening to Hurricane Sandy: Climate Change Is Here,ENVIRONMENT,"Nowhere in the world is the issue of climate change as polarizing as it is here in the U.S. American politicians' silence on climate change is not only out of step with the rest of the world, but also with the American people, the vast majority of whom are concerned about climate change.","Dr. Andrew Steer, Contributor
President & CEO, World Resources Institute",2012-11-03
https://www.huffingtonpost.com/entry/before-after-hurricane-sandy-photos_us_5bb1261de4b09bbe9a5b8d50,Before/After Hurricane Sandy Photos Show How Storm Devastated East Coast (INTERACTIVE PICTURES),ENVIRONMENT,"As the U.S. East Coast assesses the damage wreaked by Hurricane Sandy, photos have emerged revealing a very changed coastline",Jake Bialer,2012-11-03
https://www.huffingtonpost.com/entry/the-hurricane-and-the-ele_us_5bb1261de4b09bbe9a5b8d64,The Hurricane and the Election: Which President Will Give Us Shelter From the Storm?,ENVIRONMENT,"Just as Hurricane Sandy stripped our vulnerable shores, so has she stripped away our illusions that this election is just about our economy or our social issues. This election is about our future and our children's survival in a world wracked by weather disasters that climate scientists warn is the new normal.","Brenda Peterson, Contributor
Brenda Peterson Books",2012-11-03
https://www.huffingtonpost.com/entry/rockaways-sandy-death_us_5bb1261ee4b09bbe9a5b8d82,"After Death In Rockaways During Hurricane Sandy, A Question: Why Stay?",ENVIRONMENT,"************************* When the water came, everything went calm. Though the Manhattan skyline is clearly visible from",Ben Hallman,2012-11-03
https://www.huffingtonpost.com/entry/hurricane-sandy-new-york-power-outage_us_5bb12619e4b09bbe9a5b8c83,The Days After the Storm,ENVIRONMENT,"Like the firefighters who risked their lives, we of all creeds, all ages and all political stripes must come together and work with the same tireless strength and courage to replace CO2-producing energy sources with clean energy and smart grid technologies.","Billy Parish, Contributor
President, Mosaic",2012-11-03
https://www.huffingtonpost.com/entry/climate-change-politics_us_5bb12619e4b09bbe9a5b8c9b,It's Not Stupid to Question Global Warming's Role in Sandy,ENVIRONMENT,"Liberals are supposed to believe that all extreme weather is proof of climate change, and the conservative position is one of denial. When it comes to the weather, though, I prefer science to politics.","Paul Yeager, Contributor
Meteorologist and Author of 'Weather Whys: Facts, Myths, and O...",2012-11-03
https://www.huffingtonpost.com/entry/keystone-pipleline_us_5bb1261fe4b09bbe9a5b8d99,Hurricane Sandy Shows Us Why We Can't Afford Dirty Energy Projects Like the Keystone XL Tar Sands Pipeline,ENVIRONMENT,"I rarely agree with President Obama, and Governor Romney remains my choice for president on other grounds. However, my fellow Republicans should concede that the president made the right call in January when he postponed granting a permit to build the pipeline.","Steven M. Anderson, Contributor
Retired Brigadier General, Chief Marketing Officer at RELYANT LLC",2012-11-03
https://www.huffingtonpost.com/entry/hurricane-sandy-asbestos-exposure_us_5bb1261ce4b09bbe9a5b8d2c,Asbestos May Pose Health Hazards In Hurricane Sandy's Wake,ENVIRONMENT,"The latter fact may be particularly concerning given that the superstorm sent roofs buckling, breaking and blowing off buildings",Lynne Peeples,2012-11-03
https://www.huffingtonpost.com/entry/hurricane-sandy-volunteer-photos-pictures_us_5bb1261fe4b09bbe9a5b8d8c,Hurricane Sandy Volunteer PHOTOS: Send Your Pictures Of The Cleanup Effort,ENVIRONMENT,[View the widget on SlideChute] Collecting supplies at a local community center? Cleaning up debris in your neighborhood,,2012-11-03
https://www.huffingtonpost.com/entry/fighting-unruliness-hinders-hurricane-sandy-recovery_us_5bb12617e4b09bbe9a5b8c3e,"Fighting, Unruliness Hinder Hurricane Sandy Recovery In New York, New Jersey",ENVIRONMENT,Many residents of powerless neighborhoods have even managed to make a bit of light out of the mildly post-apocalyptic nature,Jaweed Kaleem and Lucas Kavner,2012-11-03
https://www.huffingtonpost.com/entry/should-flood-survivors-of_us_5bb12617e4b09bbe9a5b8c19,Should Flood Survivors of Hurricane Sandy Relocate?,ENVIRONMENT,"Fifty-five percent of the nation's population lives in counties protected by levees. The time has come to admit that one-size-fits-all flood protection will not adequately protect the regions with the most people, property and infrastructure.","Sandy Rosenthal, Contributor
Founder of Levees.org",2012-11-03
https://www.huffingtonpost.com/entry/obama-climate-change_us_5bb125f9e4b09bbe9a5b8925,Did Obama Finally Catch a Climate Break?,ENVIRONMENT,"Any bounce for Obama due to perceived linkages between Sandy and climate change is likely a good thing for environmentalists, particularly given that it is coming so close to the election.","Christopher F. Jones, Contributor
Assistant Professor, History, Arizona State University",2012-11-03
https://www.huffingtonpost.com/entry/jewelry-diy-projects-crafts-ideas_us_5bb12493e4b09bbe9a5b770d,"Jewelry DIY Projects: Fun Craft Ideas For Buttons, Beads And More",ENVIRONMENT,"From Networx's Linda Merrill: Most of us have a drawer, box or other spot where we throw slightly damaged, or even perfectly",,2012-10-28
https://www.huffingtonpost.com/entry/hurricane-sandy-pet-emergency-plan_us_5bb124b1e4b09bbe9a5b7a05,Hurricane Sandy Pet Emergency Plan,ENVIRONMENT,"7) Get Back Into A Routine -- If your pet is used to a certain walk, get them back into their usual routines, advises the",Tara Kelly,2012-10-28
https://www.huffingtonpost.comhttp://www.climatecentral.org/blogs/how-fujiwhara-effect-will-toss-hurricane-sandy-into-u.s.-15174,How Fujiwhara Effect Will Toss Hurricane Sandy Into U.S.,ENVIRONMENT,"A vortex is a flow pattern in a fluid that has rotation about a center: water spiraling down the bathtub drain, the swirling",,2012-10-28
https://www.huffingtonpost.com/entry/animal-photos-of-the-week_us_5bb124d5e4b09bbe9a5b7abb,Animal Photos Of The Week,ENVIRONMENT,"Tampa Bay, Florida's ""Mystery Monkey"" was captured this week after roaming the St. Petersburg area for several years. The",,2012-10-28
https://www.huffingtonpost.com/entry/hurricane-sandy-2012-east-coast_us_5bb124b4e4b09bbe9a5b7a39,Hurricane Sandy Threatens U.S. East Coast,ENVIRONMENT,"Sandy also blew the presidential race off course, forcing President Barack Obama and Republican challenger Mitt Romney to","Reuters, Reuters",2012-10-28
https://www.huffingtonpost.com/entry/climate-change_us_5bb124b2e4b09bbe9a5b7a16,"Climate Change Sandy Says to US, 'Take That, Idiots!'",ENVIRONMENT,We might as well keep it simple and just say this superstorm is caused by our human-made climate change.,"Nathan Currier, Contributor
composer",2012-10-28
https://www.huffingtonpost.com/entry/hurricane-sandy-power-outages_us_5bb124d7e4b09bbe9a5b7aee,"Hurricane Sandy Power Outages Could Reach 10 Million, Utilities Brace With Reinforcements",ENVIRONMENT,"Con Edison of New York said over the weekend that it was expecting damages to electrical equipment both above and, due to",Tom Zeller Jr.,2012-10-28
https://www.huffingtonpost.com/entry/hurricane-sandy-megastorm-worst-case-scenario_us_5bb124d7e4b09bbe9a5b7b0a,Hurricane Sandy Megastorm: Government Forecasters Say Projected Storm Surge Is A 'Worst Case Scenario' [LIVE UPDATES],ENVIRONMENT,"In this case, seas will be amped up by giant waves and full-moon-powered high tides. That will combine with drenching rains",Adam Goldberg,2012-10-28
https://www.huffingtonpost.com/entry/hurricane-sandy-map_us_5bb124d7e4b09bbe9a5b7b10,Hurricane Sandy Map Shows Storm's Path Towards U.S. Northeast,ENVIRONMENT,"As Hurricane Sandy moves north through the Atlantic, cities in the U.S. Northeast are bracing for ""a potential 1 in 100 year",,2012-10-28
https://www.huffingtonpost.com/entry/hurricane-sandy-long-island_us_5bb124d8e4b09bbe9a5b7b22,"Hurricane Sandy: Long Island Braces For Flooding, Power Outages",ENVIRONMENT,"The 62-year-old songwriter has multiple medical complications as a result of having polio in 1954. Pavane, who lives in New",Joy Resmovits,2012-10-28
https://www.huffingtonpost.com/entry/hurricane-sandy-2012-photos-images-storm-path-east-coast_us_5bb124afe4b09bbe9a5b79bd,Hurricane Sandy 2012 Photos: Images Capture Storm's Path Of Destruction (PICTURES),ENVIRONMENT,"Haitians continue to struggle from the 2010 earthquake, and concerns are mounting once again. “The situation is disastrous",Cavan Sieczkowski,2012-10-27
https://www.huffingtonpost.comhttp://www.climatecentral.org/news/hurricane-sandy-five-fold-flood-threat-with-local-maps-15168,Local Maps Show Hurricane Sandy's Five-Fold Flood Threat,ENVIRONMENT,Hurricane Sandy threatens to cause major coastal flooding from North Carolina to Maine. Use the links below to see interactive,,2012-10-27
https://www.huffingtonpost.com/entry/frankenstorm-fact-and-fic_us_5bb124aee4b09bbe9a5b79a3,Frankenstorm: Fact and Fiction,ENVIRONMENT,"With so much information being generated from weather and non-weather sources, it's difficult to separate fact from fiction. If you're in the potential path of the storm, then follow local sources of weather information extremely closely and take any necessary actions to best prepare yourself.","Paul Yeager, Contributor
Meteorologist and Author of 'Weather Whys: Facts, Myths, and O...",2012-10-27
https://www.huffingtonpost.com/entry/persistent-oil-sheen-at-m_us_5bb124afe4b09bbe9a5b79ae,Persistent Oil Sheen at Macondo Well Site,ENVIRONMENT,"There is a real problem at the site. Oil is definitely there, and it is a true problem. Think about it. From April 20, 2010 to July 15, 2010, the well flowed something around 5 million barrels of oil into the ocean environment. Only a small portion of that oil was recovered or burned.","Robert L. Cavnar, Contributor
Energy Veteran and Author, Founder, this-small-planet.com",2012-10-27
https://www.huffingtonpost.com/entry/the-politics-of-climate-silence_us_5bb124a9e4b09bbe9a5b78af,The Politics of 'Climate Silence',ENVIRONMENT,"So what's going on? Well, you could start by following the money. Of the $12.5 million donated to by the energy and natural resources industries to political action committees supporting a presidential candidate this campaign cycle, 84 percent went to Republicans.","Tom Zeller Jr., Contributor
MIT Knight Science Journalism Fellow",2012-10-27
https://www.huffingtonpost.com/entry/animal-photos-of-the-week_us_5bb12417e4b09bbe9a5b6c95,Animal Photos Of The Week,ENVIRONMENT,"Below, find some of our favorite animal photos taken in the past week: A keeper at Sydney's Taronga Zoo was critically injured",,2012-10-21
https://www.huffingtonpost.com/entry/pesticides-bumblebee-colonies_us_5bb12430e4b09bbe9a5b6cc4,"Pesticides Are Killing Bumblebee Colonies, Risking Pollination Vital To Plant-Based Foods, Study Says",ENVIRONMENT,PARASITES The average number of bees lost in the experiment - both dead in the nesting box and failing to return - was about,"Reuters, Reuters",2012-10-21
https://www.huffingtonpost.com/entry/best-sloth-videos-funny-cute_us_5bb1238ce4b09bbe9a5b6272,Best Sloth Videos Ever: Funny And Cute Clips Of The World's Slowest Mammal,ENVIRONMENT,"Being slow and somewhat lazy give sloths a bad rap. But thankfully, people have realized how cute these furry guys are, with",,2012-10-20
https://www.huffingtonpost.com/entry/julianne-moore-climate-change_us_5bb123bde4b09bbe9a5b65fa,Actress Julianne Moore Asks Washington for a Plan to Fight Climate Change,ENVIRONMENT,"Scientists can enlightens us with sound science and tell us,""The wait and see approach to the climate crisis will be too late,"" while celebrities can illuminate and help amplify this message.","Ronnie Citron-Finkl, Contributor
Editorial Director, Moms Clean Air Force",2012-10-20
https://www.huffingtonpost.com/entry/un-green-climate-fund-south-korea_us_5bb123ece4b09bbe9a5b6ba2,U.N. Green Climate Fund To Be Based In South Korea,ENVIRONMENT,"The Green Climate Fund is to be sited in Songdo, Incheon City, South Korea, the board of the fund said. Germany, Mexico, Namibia","Reuters, Reuters",2012-10-20
https://www.huffingtonpost.com/entry/green-halloween-costumes-2012_us_5bb12344e4b09bbe9a5b5f20,"Green Halloween Costumes 2012: Easy, Free DIY Ideas For Kids And Adults",ENVIRONMENT,"Do you have an easy, free Halloween costume planned for this year or that you've worn in years past? Submit your photo to",,2012-10-14
https://www.huffingtonpost.comhttp://www.earthtechling.com/2012/10/green-landscapes-green-wineries-go-hand-in-hand-in-oregon/,"In Oregon, Green Landscapes And Green Wineries Go Hand In Hand",ENVIRONMENT,"“The flagship for the Oregon wine industry is a bottle of super-premium Pinot Noir,” he told us. “A stellar Oregon Pinot",,2012-10-14
https://www.huffingtonpost.com/entry/clean-energy-investment_us_5bb1235de4b09bbe9a5b5fc1,Clean Energy Investment Slows Amid Uncertainty,ENVIRONMENT,Unless there’s a remarkable turnaround brewing right now — and nobody’s seeing any such thing — 2012 could give us the first,,2012-10-14
https://www.huffingtonpost.com/entry/animal-photos-of-the-week_us_5bb12382e4b09bbe9a5b607c,Animal Photos Of The Week,ENVIRONMENT,"In a civil lawsuit filed in Montana state court this week, eight conservation groups requested a judge to end wolverine trapping",,2012-10-14
https://www.huffingtonpost.comhttp://earth911.com/news/2012/10/09/never-use-foil-or-plastic-wrap-again/,Reusable Replacements For Foil And Plastic Wrap,ENVIRONMENT,"To help you halt the endless stream of single-use cooking waste, Earth911 gathered up five clever (and reusable) ways to",,2012-10-13
https://www.huffingtonpost.com/entry/recycling-electronics-donating-wedding-dress_us_5bb1235de4b09bbe9a5b5fb3,"Recycling Electronics, Donating Books And More: 10 Things To Give To Charity",ENVIRONMENT,"From Earth911's Mary Mazzoni: Sure, you can extend the life of your recyclables by tossing them in the curbside bin, but",,2012-10-13
https://www.huffingtonpost.com/entry/california-green-energy_us_5bb12345e4b09bbe9a5b5f89,Climate Law Is Good Business for California,ENVIRONMENT,"AB32 should be a no-brainer for California businesses, so long as it's done right. Implementing the law is a challenge we all face moving forward, but it's one that smart state businesses should be engaged in, not fighting against.","Kate Gordon, Contributor
Vice President and Director of the Energy & Climate Program, N...",2012-10-13
https://www.huffingtonpost.com/entry/carbon-dioxide-may-damage_us_5bb12382e4b09bbe9a5b60aa,"Carbon Dioxide May Damage Glaciers, Researchers Suggest",ENVIRONMENT,Reach Becky Oskin at boskin@techmedianetwork.com. Follow her on Twitter@beckyoskin. Follow OurAmazingPlanet on Twitter @OAPlanetWe're,,2012-10-13
https://www.huffingtonpost.com/entry/oil-transport-industry-report_us_5bb122f7e4b09bbe9a5b5837,"Oil Losing Grip On Transport Industry Market, Report Claims",ENVIRONMENT,"LONDON, Oct 8 (Reuters) - - The transport industry that burns over half the world's oil is wriggling free from dependence","Reuters, Reuters",2012-10-07
https://www.huffingtonpost.com/entry/greenhouse-gas-emissions-gdp_us_5bb122f2e4b09bbe9a5b5807,"Greenhouse Gas Emissions Rise With GDP But Slower To Fall During Recession, Study Finds",ENVIRONMENT,"Emissions of carbon dioxide, the main greenhouse gas, rose by an average of 0.73 percent for every 1 percent growth in gross","Reuters, Reuters",2012-10-07
https://www.huffingtonpost.com/entry/animal-photos_us_5bb122f1e4b09bbe9a5b57c6,Animal Photos Of The Week,ENVIRONMENT,"This week saw several good stories emerge from the animal world. In Costa Rica, national park rangers rescued an endangered",,2012-10-07
https://www.huffingtonpost.com/entry/fostering-pringle_us_5bb122a3e4b09bbe9a5b53ab,Fostering Pringle,ENVIRONMENT,"His name is Pringle. Well, that's the name the rescue folks gave the scrawny Yorkie-mixed breed they'd found dumped on the streets of a neighborhood known for their high kill shelter. He is my first foster dog.","Carol Hoenig, Contributor
I am an author, publishing consultant and bookstore owner.",2012-10-07
https://www.huffingtonpost.comhttp://www.mnn.com/lifestyle/eco-tourism/photos/8-creepiest-places-in-us-national-parks/haunted-hikes,8 Creepiest Places In U.S. National Parks,ENVIRONMENT,"For the most part, there's nothing to fear, but if you're looking to add a little spooky spice to your next outdoor adventure",,2012-10-06
https://www.huffingtonpost.com/entry/avatar-sequel-sets-green-eco-friendly_us_5bb122bbe4b09bbe9a5b56fd,"'Avatar' 2 Will Have Greener Set With Solar Array, James Cameron Announces",ENVIRONMENT,"Beyond the green themes present in both production and the films' plot lines, the 58-year-old director also has big plans",,2012-10-06
https://www.huffingtonpost.com/entry/peter-grillo-hawaii-japan-tsunami_us_5bb122d5e4b09bbe9a5b5772,"Peter Grillo, Hawaii Fisherman, Finds Japanese Boat, Debris From 2011 Tsunami",ENVIRONMENT,"""When it occurred to me that it could have come from Japan, and from the tsunami, I measured from where I was to Tokyo Bay",,2012-10-06
https://www.huffingtonpost.comhttp://blog.bird-rescue.org/index.php/2012/10/remembering-new-zealands-rena-oil-spill-1-year-later/,"Remembering New Zealand's Rena Oil Spill, 1 Year Later",ENVIRONMENT,"In the early morning hours of October 5, 2011, the MV Rena, a large cargo ship carrying 1,368 containers, struck a reef in",,2012-10-06
https://www.huffingtonpost.com/entry/bp-oil-spill-settlement-senators_us_5bb122bde4b09bbe9a5b573f,BP Oil Spill Settlement: Gulf Coast Senators Sign Bipartisan Letter Seeking Fair Deal,ENVIRONMENT,By Roberta Rampton In a bipartisan letter - a rare sight ahead of the Nov. 6 presidential elections - eight senators told,"Reuters, Reuters",2012-10-06
https://www.huffingtonpost.com/entry/seafloor-explorer-seahorse-habcam-images_us_5bb121ede4b09bbe9a5b43f2,Seafloor Explorer: Underwater Images Project Opens To The Public (PHOTOS),ENVIRONMENT,"A press release explains: Public contributors to the website will say whether they see fish, scallops and other organisms",,2012-09-30
https://www.huffingtonpost.com/entry/animal-photos-of-the-week_us_5bb12266e4b09bbe9a5b4d66,Animal Photos Of The Week,ENVIRONMENT,"In case you missed it, check out this video of a woman hand-feeding a wild stingray. This week we witnessed a female dolphin",,2012-09-30
https://www.huffingtonpost.com/entry/climate-change-fish-shrinking_us_5bb12266e4b09bbe9a5b4d7c,Climate Change To Shrink Fish By 2050 As Oceans Warm,ENVIRONMENT,"Adding to climate change, other human factors ""such as over-fishing and pollution, are likely to further exacerbate such","Reuters, Reuters",2012-09-30
https://www.huffingtonpost.com/entry/alpaca-facts-interesting_us_5bb12231e4b09bbe9a5b4b89,Alpaca Facts: 10 Things You Never Knew About The Llama's Quirky Relative,ENVIRONMENT,"This Sept. 29-30 is National Alpaca Farm Day (well, weekend, really), so in honor of all things Vicugna pacos, we're filling",,2012-09-29
https://www.huffingtonpost.comhttp://www.mnn.com/money/green-workplace/blogs/exploratorium-aims-for-net-zero-energy-use,Exploratorium Aims For Net-Zero Energy Use,ENVIRONMENT,"If it meets the goal, this science museum in San Francisco will be the largest net-zero energy use museum in the nation. Read",,2012-09-29
https://www.huffingtonpost.com/entry/great-white-sharks-endangered-species-list_us_5bb12236e4b09bbe9a5b4c01,Pacific Great Whites Inch Closer to Protection,ENVIRONMENT,"Since the release of Jaws in 1975, we've been wading into the water a bit more tentatively. But it is the sharks that need to worry. They've been around for almost half a billion years, but they could go extinct on the West Coast in the coming decades.","Andy Sharpless and January Jones, Contributors",2012-09-29
https://www.huffingtonpost.com/entry/y-12-national-security-complex_us_5bb12237e4b09bbe9a5b4c2d,"Y-12 National Security Complex, Tennessee Nuclear Site, Ends Security Contract Following Nun's Break-In",ENVIRONMENT,"Chu received a classified review of the Y-12 incident earlier in the week by the department's health, safety, and security","Reuters, Reuters",2012-09-29
https://www.huffingtonpost.com/entry/carmageddon-los-angeles-air-quality_us_5bb12255e4b09bbe9a5b4c5d,"Carmageddon Improved Los Angeles Air Quality During 2011 Freeway Closure, Study Shows",ENVIRONMENT,"A spokesman for the South Coast Air Quality Management District, Sam Atwood, told the Los Angeles Times that LA has the ""worst",James Gerken,2012-09-29
https://www.huffingtonpost.com/entry/volunteering-with-pets_us_5bb12194e4b09bbe9a5b3c33,Volunteering With Pets: How To Give Back With Your Dog Or Cat,ENVIRONMENT,From Mother Nature Network's Sidney Stevens: Our pets bring us joy and enrich our lives. But they can also bring joy and,,2012-09-23
https://www.huffingtonpost.comhttp://www.mnn.com/lifestyle/arts-culture/blogs/affleck-and-damon-reteam-for-race-to-the-south-pole,Affleck And Damon Team Up Again For 'Race To The South Pole',ENVIRONMENT,Film will be based on the true story of 2 explorers in the early 1900s and their quest to be the first to reach the South,,2012-09-23
https://www.huffingtonpost.comhttp://www.climatecentral.org/news/forget-the-melting-arctic-the-sea-ice-in-antarctica-is-growing-skeptics-say-15032,"Forget The Melting Arctic, Sea Ice In Antarctica Is Growing!!",ENVIRONMENT,The sea ice that covers the Arctic Ocean has plummeted to its lowest level on record -- but down at the other end of the,,2012-09-23
https://www.huffingtonpost.com/entry/extreme-weather-insurers-risk-models_us_5bb12195e4b09bbe9a5b3c85,"Extreme Weather Threaten Insurers' Risk Models, New Report Shows",ENVIRONMENT,"From Climate Central's Andrew Freedman: Sharlene Leurig, a senior manager in Ceres’ insurance program and a coauthor of the",,2012-09-23
https://www.huffingtonpost.com/entry/animal-photos-of-the-week_us_5bb121bae4b09bbe9a5b3db6,Animal Photos Of The Week,ENVIRONMENT,"This week, the world learned more about what may be the first-ever liliger. Born last month at a zoo in Russia, Kiara is",,2012-09-23
https://www.huffingtonpost.com/entry/dwindling-arctic-ice-sign_us_5bb12197e4b09bbe9a5b3cff,Dwindling Arctic Ice Signals a Clear Need for Change,ENVIRONMENT,The dramatic changes happening in the Arctic should send shockwaves through the world about the polluting energy sources we use to power our lives. We can no longer operate in business-as-usual mode.,"Rocky Kistner, Guest Writer
Guest Writer",2012-09-22
https://www.huffingtonpost.com/entry/gmo-proposition-37-study-funding-research_us_5bb12195e4b09bbe9a5b3c71,"GMO Debate Heats Up: Critics Say Biotech Industry Manipulating Genes, And Science",ENVIRONMENT,"""I do think that this new study again raises an alarm bell, and ought to be followed up by much more careful studies with",Lynne Peeples,2012-09-22
https://www.huffingtonpost.com/entry/first-day-of-fall-autumnal-equinox_us_5bb121bae4b09bbe9a5b3dc3,First Day Of Fall: Autumnal Equinox Arrives On September 22,ENVIRONMENT,"That's because geomagnetic storms, which are disturbances in Earth's magnetic field, are more common in spring and fall than",,2012-09-22
