link,headline,category,short_description,authors,date
https://www.huffpost.com/entry/oil-gas-coal-reserves-database_n_6327a81ae4b0eac9f4e2fd23,First Public Global Database Of Fossil Fuels Launches,ENVIRONMENT,"On Monday, the world’s first public database of fossil fuel production, reserves and emissions launches.","Drew Costley, AP",2022-09-18
https://www.huffpost.com/entry/bc-us-alaska-coastal-storm_n_6325f39fe4b0eac9f4e25cbc,Alaska Prepares For 'Historic-Level' Storm Barreling Towards Coast,ENVIRONMENT,"“In 10 years, people will be referring to the September 2022 storm as a benchmark storm.”","BECKY BOHRER, MARK THIESSEN and JOHN ANTCZAK, AP",2022-09-17
https://www.huffpost.com/entry/tropical-storm-fiona-puerto-rico_n_6325d372e4b0ed021dfd719c,Puerto Rico Braces For Landslides And Severe Flooding As Tropical Storm Fiona Approaches,ENVIRONMENT,Puerto Rico was under a hurricane watch Saturday as the storm barreled towards the U.S. territory.,"DÁNICA COTO, AP",2022-09-17
https://www.huffpost.com/entry/jackson-water-crisis-privatization_n_6324d6c2e4b0ed021dfd034f,Privatization Isn’t The Answer To Jackson’s Water Crisis,ENVIRONMENT,Studies have repeatedly shown that ending public administration of water supplies doesn’t work — but that’s now on the table in Mississippi.,Nathalie Baptiste,2022-09-17
https://www.huffpost.com/entry/bc-us-california-wildfires_n_631c9b62e4b000d988519ee3,Severe Winds Batter Southern California As Heat Wave Breaks,ENVIRONMENT,"After a 10-day heat wave that nearly overwhelmed the electrical grid, Southern California got cooler weather but also a ferocious tropical storm.","JULIE WATSON and JOHN ANTCZAK, AP",2022-09-10
https://www.huffpost.com/entry/ap-us-bay-area-dead-fish_n_63113130e4b020c4ffab4841,Toxic Algae Causes Thousands Of Dead Fish To Wash Ashore In California,ENVIRONMENT,The unprecedented red tide is creating a foul odor that may get worse during the oncoming heat wave.,"TERRY CHEA and OLGA R. RODRIGUEZ, AP",2022-09-01
https://www.huffpost.com/entry/fish-dead-uc-california-davis_n_62f81d09e4b095e78880f0e5,"'Catastrophic Failure' At Research Center Kills About 21,000 Fish",ENVIRONMENT,"University of California, Davis is investigating what led to the deaths of tens of thousands of fish, including chinook salmon.",Hilary Hanson,2022-08-13
https://www.huffpost.com/entry/bc-eu-poland-germany-polluted-river_n_62f7bbdce4b0ab35e0b36f5a,'Shocking' Fish Die-Off Sends Poland Scrambling To Determine Source,ENVIRONMENT,"Polish Prime Minister Mateusz Morawiecki suspects ""“huge amounts of chemical waste"" were dumped into the country's second largest river.",,2022-08-13
https://www.huffpost.com/entry/zachary-alligator-new-york_n_62ee9555e4b09fecea4e863b,New York Couple Turns In 5-Foot Gator 'Zachary' They'd Been Keeping In Home,ENVIRONMENT,Zachary will be headed to a sanctuary where a better life is ahead of him.,Hilary Hanson,2022-08-06
https://www.huffpost.com/entry/bc-us-southwest-thunderstorms-flooding_n_62e53cf4e4b006483a9deb97,Rain Cascades From Vegas Casino Ceilings As Thunderstorms Flood Desert,ENVIRONMENT,"Parts of the parched southwest are now being hit with floods, with multiple people needing rescue in Nevada and Arizona.","Ken Ritter and Felicia Fonsetta, AP",2022-07-30
https://www.huffpost.com/entry/bc-us-dying-manatees-florida_n_62d85465e4b0aad58d160915,"Chronic Starvation Remains Threat To Florida Manatees, Officials Say",ENVIRONMENT,"Last year, a record number of manatees died mainly from a lack of seagrass food, which was decimated by water pollution.","CURT ANDERSON, AP",2022-07-20
https://www.huffpost.com/entry/netherlands-nuclear-energy_n_62aba4d2e4b04a61735a273a,"The Netherlands, Facing Energy And Climate Crises, Bets On A Nuclear Revival",ENVIRONMENT,This isn’t the country's first attempt at an atomic renaissance. Will the Dutch actually make it work this time?,Alexander C. Kaufman,2022-06-26
https://www.huffpost.com/entry/11-foot-alligator-man-dead-myrtle-beach-south-carolina_n_62b7d7a2e4b04a61736b6c7b,Man Killed By 11-Foot Alligator At South Carolina Pond,ENVIRONMENT,The giant reptile was captured and euthanized on site.,Mary Papenfuss,2022-06-26
https://www.huffpost.com/entry/bear-dies-hot-car-tennessee_n_62b71e97e4b0cdccbe6c3839,Bear Looking For Food Dies Inside Hot Car On Sweltering Day,ENVIRONMENT,A black bear's death in Tennessee was a sad reminder of the dangers of both hot cars and leaving food unattended in bear country.,Hilary Hanson,2022-06-25
https://www.huffpost.com/entry/yellowstone-national-park-flooding_n_62a7de48e4b04a617353121a,"Yellowstone Floods Wipe Out Roads, Bridges, Strand Visitors",ENVIRONMENT,Flooding has wiped out roads and bridges and closed off all entrances to Yellowstone National Park at the onset of the busy summer tourist season.,"AMY BETH HANSON, AP",2022-06-14
https://www.huffpost.com/entry/fish-bees-california-endangered-species_n_6299a0b3e4b0c184bdcf7f30,Court Rules That California Bees Can Be Fish And Have The Same Protections,ENVIRONMENT,"“The court’s decision allows California to protect some of its most endangered pollinators.""",Mary Papenfuss,2022-06-03
https://www.huffpost.com/entry/piedmont-lithium-mine_n_62869f4be4b0933e7362d58c,The Lithium War Next Door,ENVIRONMENT,A lithium mining startup promised to make a rural pocket of North Carolina a clean-energy boomtown. But perceived slights and concerns over water have turned neighbors against the project.,Alexander C. Kaufman,2022-05-22
https://www.huffpost.com/entry/11-foot-alligator-florida-pool_n_6288fb62e4b01a50ab590226,"Family Hears Noise, Finds 550-Pound Alligator 'Taking A Dip' In Their Pool",ENVIRONMENT,And that's why you never belly-flop without looking first.,Hilary Hanson,2022-05-21
https://www.huffpost.com/entry/hawaiian-monk-seals-comeback_n_6276addbe4b0b7c8f084ebe1,Everybody Clap! Endangered Seal Species Hits Comeback Milestone,ENVIRONMENT,"Hawaiian monk seals still face major threats, but their numbers are higher than they've been in 20 years.",Hilary Hanson,2022-05-07
https://www.huffpost.com/entry/spring-wildfires-arizona-flee-fight_n_626ef23ce4b029505df3a36e,Arizona Wildfire Forces Fast Decision: Fight Or Flee Flames?,ENVIRONMENT,Ferocious winds that sent what was a small wildfire racing toward homes on the outskirts of Flagstaff presented residents with a dilemma.,"Felicia Fonseca, AP",2022-05-01
https://www.huffpost.com/entry/kansas-tornado-wichita_n_626d3ec8e4b0bc48f57c09b2,Homes 'Completely Blown Away' By Suspected Tornado In Kansas,ENVIRONMENT,"A suspected twister barreled through parts of Kansas, injuring several people, damaging multiple buildings and leaving thousands without power.",,2022-04-30
https://www.huffpost.com/entry/twitter-climate-change-disinformation_n_6263cc59e4b0197ae3f5fb13,Twitter Bans Ads That Contradict Science On Climate Change,ENVIRONMENT,But there's no indication the move will affect what users post on the platform.,,2022-04-23
https://www.huffpost.com/entry/climate-protests-arrest-london_n_625afa07e4b0be72bff6c2fe,Climate Change Activists Climb Atop Oil Tanker In Mass Protests In London,ENVIRONMENT,Hundreds of people blocked bridges across London while others scaled an oil tanker in mass protests to demand a stop to new oil and gas projects.,,2022-04-16
https://www.huffpost.com/entry/biden-resume-oil-gas-leases_n_6259ee3ee4b052d2bd61eea2,Biden To Resume Oil And Gas Lease Sales On Federal Land While Upping Royalties,ENVIRONMENT,President Joe Biden had suspended lease sales a week after taking office as part of his climate change plan.,"Matthew Brown, AP",2022-04-15
https://www.huffpost.com/entry/climate-change-goal-life-support_n_6238bc9ae4b009ab92fbb7e6,"Goal Of Capping Global Warming At 1.5 Degrees Celsius Is 'On Life Support,' UN Chief Warns",ENVIRONMENT,"“There is no kind way to put it,” United Nations Secretary-General António Guterres said.",Lydia O'Connor,2022-03-21
https://www.huffpost.com/entry/midwest-severe-weather-iowa_n_62243ac9e4b042f866eee7ef,Official: 6 Dead As Large Tornado Roars Through Central Iowa,ENVIRONMENT,A county official also said 25 to 30 homes were badly damaged by the tornado.,,2022-03-06
https://www.huffpost.com/entry/dog-raised-cheetah-cubs-coby-dies_n_61d9c356e4b0bcd2195fd7d5,Zoo Mourns Death Of 'Beloved' Dog Who Helped Raise Cheetah Cubs,ENVIRONMENT,"Coby, a yellow Lab, ""made everyone feel special,"" the Columbus Zoo said.",Hilary Hanson,2022-01-08
https://www.huffpost.com/entry/navy-objects-hawaii-fuel_n_61ce0481e4b061afe3a5a92d,Navy Objects To Recommendation It Drain Hawaii Fuel Tanks,ENVIRONMENT,State officials are seeking to hold the U.S. Navy accountable for a leak at a fuel tank farm that sits above an aquifer that provides drinking water for Oahu.,"Audrey McAvoy, AP",2021-12-30
https://www.huffpost.com/entry/tiger-zoo-shot-naples-zoo_n_61cde84ce4b0d637ae9479b9,Zoo Tiger Shot And Killed After Biting Man Who Put Hand Through Fence,ENVIRONMENT,"A sheriff's deputy shot Eko, an 8-year-old Malayan tiger, when he wouldn't let go of the arm of a cleaning service employee who reached into his enclosure.",Hilary Hanson,2021-12-30
https://www.huffpost.com/entry/biomass-energy-power-plants_n_61bcb6cae4b0a3722477d16a,A ‘Green’ Energy Project Leaves A Mississippi Town Gasping For Air,ENVIRONMENT,European climate subsidies funnel billions to wood-burning power plants that harvest trees from the U.S. South. The industry is taking a toll locally and globally.,Alexander C. Kaufman,2021-12-18
https://www.huffpost.com/entry/tornado-kentucky-climate-change-storms_n_61b60745e4b0b50268a7678c,Explainer: Was Deadly Tornado Storm System Related To Climate Change?,ENVIRONMENT,"Warm weather was a crucial ingredient in the outbreak that killed dozens of people, but whether climate change is a factor is not quite as clear.",,2021-12-12
https://www.huffpost.com/entry/right-whale-gives-birth-fishing-rope_n_61b4e0e7e4b0030da7d5c272,Endangered Right Whale Gives Birth While Entangled In Fishing Gear,ENVIRONMENT,A whale named Snow Cone has surprised scientists by giving birth to a healthy calf despite being encumbered by heavy fishing rope.,Hilary Hanson,2021-12-11
https://www.huffpost.com/entry/hippos-covid-positive-antwerp-zoo_n_61ad7c9be4b0f398af22d85c,Pair Of Belgium Zoo Hippos Get COVID In What May Be First Cases For Species,ENVIRONMENT,"Imani and Hermien only have runny noses so far, according to zoo officials.",Mary Papenfuss,2021-12-06
https://www.huffpost.com/entry/ap-us-hawaii-blizzard-warning_n_61abb205e4b0f398af21da66,Hawaii Gets Blizzard Warning As Denver Remains Snow-Free,ENVIRONMENT,"Blizzard warnings for Hawaii are rare, but not totally unheard of.",,2021-12-04
https://www.huffpost.com/entry/americans-climate-change-real-survey_n_6196a0b6e4b044a1cc048d83,More Americans Than Ever Understand Climate Change Is Real And Harmful,ENVIRONMENT,"About 3 in 4 survey respondents believe global warming is happening, and more than half agree that we are being harmed by climate change “right now.”",Sarah Ruiz-Grossman,2021-11-18
https://www.huffpost.com/entry/ap-eu-climate-cop26_n_618e6ba3e4b0ab5f2848a8bf,Climate Conference Reverses Course On Call To End Coal Use,ENVIRONMENT,"An earlier proposal at the 2021 United Nations Climate Change Conference called on nations to ""accelerate the phasing out of coal and subsidies for fossil fuel.""","Seth Borenstein, Karl Ritter, AP",2021-11-12
https://www.huffpost.com/entry/black-footed-ferret-colorado-garage_n_618c3498e4b0c621c5c86697,North America's Rarest Mammal Makes 'Surprise Appearance' In Colorado Garage,ENVIRONMENT,The garage-crashing black-footed ferret surprised a homeowner in Pueblo West.,Josephine Harvey,2021-11-10
https://www.huffpost.com/entry/atacama-desert-climate_n_6180292de4b0bf8728db7803,This Desert May Contain Secrets To Avoiding Climate Famine,ENVIRONMENT,A landmark new study of plant life in one of the world’s driest places could yield new drought-resistant crops — if mining for electric vehicle batteries doesn't destroy the ecosystems first.,Alexander C. Kaufman,2021-11-01
https://www.huffpost.com/entry/shelleys-eagle-owl-photographed_n_61745193e4b079111a581627,Elusive Owl Caught On Camera After Flying Under Radar For 150 Years,ENVIRONMENT,Shelley's eagle owl had never been clearly photographed in the wild — until now.,Hilary Hanson,2021-10-23
https://www.huffpost.com/entry/600-lb-sea-turtle-rescue_n_616b0902e4b0931431fe24df,600-lb Stranded Sea Turtle Splashes Back Into The Ocean After Rescue,ENVIRONMENT,"The large leatherback apparently got ""disoriented"" in Cape Cod Bay, but after a change of scenery and some vitamins, he was good to go.",Hilary Hanson,2021-10-16
https://www.huffpost.com/entry/joro-spiders-invasive-georgia_n_615871e0e4b0487c855f6263,'Extreme Numbers' Of Large Invasive Spiders In Georgia May Be A Good Thing,ENVIRONMENT,"The palm-sized Joro spiders may look freaky, but they're not dangerous and even provide some big benefits.",Hilary Hanson,2021-10-02
https://www.huffpost.com/entry/lions-covid-national-zoo-baby-food_n_614f41bae4b06beda46fc3b0,"COVID-Sick Zoo Lions Fed 'Tempting' Baby Food, Chicken Broth To Amp Up Appetites",ENVIRONMENT,"Lions and tigers at the National Zoo in Washington, D.C., tested positive for the coronavirus last week.",Hilary Hanson,2021-09-25
https://www.huffpost.com/entry/wolves-endangered-species_n_61427a11e4b0b616054476d3,Red States’ Wolf-Killing Campaign May Have Just Backfired,ENVIRONMENT,The U.S. Fish and Wildlife Service might put gray wolves back under Endangered Species Act protection after Idaho and Montana enacted laws to cull them.,Roque Planas and Chris D'Angelo,2021-09-16
https://www.huffpost.com/entry/oil-spill-hurricane-ida-birds_n_613ce0a6e4b0628d095beab9,More Than 100 Birds Found Covered In Oil After Hurricane Ida Refinery Spill,ENVIRONMENT,"Some oiled birds have already been rescued from the Alliance Refinery spill, but the operation could take weeks, Louisiana wildlife officials say.",Hilary Hanson,2021-09-11
https://www.huffpost.com/entry/great-white-shark-missing-teeth_n_613b79cae4b0628d095aeafe,Great White Shark Is Missing 'Unusual' Amount Of Teeth: 'Anyone Know A Good Dentist?',ENVIRONMENT,A cage-diving expedition off Mexico's Guadalupe Island discovered the chomper-challenged predator.,Ron Dicker,2021-09-10
https://www.huffpost.com/entry/south-lake-tahoe-bears_n_61365eabe4b0df9fe279efce,Californians Coming Home After Fleeing Wildfire Now Face Bear Break-Ins,ENVIRONMENT,South Lake Tahoe residents returning from fleeing the Caldor Fire have reported break-ins — but most have been by bears.,Hilary Hanson,2021-09-06
https://www.huffpost.com/entry/hurricane-ida-category-4-louisiana_n_61295e8be4b09266434bfc92,Hurricane Ida Predicted To Hit Louisiana On Katrina Anniversary,ENVIRONMENT,"Hurricane Ida struck Cuba on Friday and threatened to slam into Louisiana with far greater force over the weekend, prompting evacuations.","Kevin McGill and Janet McConnaughey, AP",2021-08-27
https://www.huffpost.com/entry/biden-wolves-endangered-species-hunting_n_61210e83e4b0e5b5d8ea7bf2,Biden Sticks By Trump Decision To Strip Wolves Of Endangered Species Protections,ENVIRONMENT,"Since gray wolves have lost federal protections, some states have adopted aggressive hunting seasons allowing large numbers to be killed.","Matthew Brown and John Flesher, AP",2021-08-21
https://www.huffpost.com/entry/wisconsin-wolf-hunt-quota-species-threatened_n_6119b3f2e4b0f7bc26a6d352,Wisconsin Doubles Wolf Hunt Quota Even After Biologists Warn Of Serious Risk To Population,ENVIRONMENT,"""Nothing will dissuade the desire for more blood from our brother,"" said the leader of a Wisconsin Chippewa tribe, which considers the wolf sacred.",Mary Papenfuss,2021-08-16
https://www.huffpost.com/entry/keith-poe-hand-feeds-mako-shark_n_6113b9c2e4b07eef5d7724a5,"Man Hand-Feeds Mako Shark, Still Has Hand",ENVIRONMENT,"Keith Poe, who has tagged thousands of sharks off California, says the feeding is all about ""getting to know each other.""",Ron Dicker,2021-08-11
https://www.huffpost.com/entry/alaska-whales-cruise-ship-noise-pandemic_n_610ed664e4b05f81570ae515,The Pandemic Has Let Alaskan Whales Get Some Peace And Quiet,ENVIRONMENT,Reduced noise from cruise ships has made a big difference in the lives of humpback whales in Glacier Bay.,Hilary Hanson,2021-08-07
https://www.huffpost.com/entry/man-killed-bee-swarm-arizona_n_61061856e4b0d3b5897e5f51,"Bee Swarm Attack In Arizona Kills Man, Injures Several Others",ENVIRONMENT,"Some victims were stung ""hundreds of times.""",Mary Papenfuss,2021-08-01
https://www.huffpost.com/entry/oregon-wildfire-investment_n_61044a78e4b0048f361d415e,Oregon Investing $220 Million To Handle Growing Wildfire Problem,ENVIRONMENT,Gov. Kate Brown signed the bill as the massive Bootleg fire raged in southern Oregon.,Lydia O'Connor,2021-07-30
https://www.huffpost.com/entry/stony-coral-tissue-loss-disease-ship-waste-water-bahamas-caribbean_n_60ff56a4e4b05ff8cfcb817b,Deadly Caribbean Coral Disease Linked To Ship Wastewater,ENVIRONMENT,"The ""greatest declines"" in coral in the Bahamas are linked by researchers to the stony coral tissue loss disease, which may be triggered by ship traffic.",Mary Papenfuss,2021-07-27
https://www.huffpost.com/entry/orca-toa-new-zealand_n_60f9f06ae4b0d1bafbfc1feb,Stranded Baby Orca In New Zealand Sparks Nationwide Search For His Pod,ENVIRONMENT,"The orca calf, named Toa, which means hero in Māori, is receiving round-the-clock care.",Josephine Harvey,2021-07-23
https://www.huffpost.com/entry/videos-china-floods-subway-trapped_n_60f75f6fe4b0ddf00979396e,Dramatic Videos Show Deadly Flooding In China,ENVIRONMENT,People were trapped in waist-high water on the subway and cars floated through the streets as severe floods tore through China’s Henan province.,Sarah Ruiz-Grossman,2021-07-21
https://www.huffpost.com/entry/great-salt-lake-low-birds_n_60f31fc6e4b0b2a04a244682,Scientists Fear For Birds As Utah's Great Salt Lake Nears Record Low Levels,ENVIRONMENT,The vibrant ecosystem of North America's largest saltwater lake is under serious threat from water diversion and climate change-fueled drought.,Hilary Hanson,2021-07-17
https://www.huffpost.com/entry/lake-tuz-turkey-dead-drought-flamingos_n_60f263abe4b0a771e804416f,Thousands Of Flamingos Die As Lake In Turkey Dries Up In Drought,ENVIRONMENT,Environmentalists say the birds are being sacrificed to climate change and wasteful agricultural irrigation.,Mary Papenfuss,2021-07-17
https://www.huffpost.com/entry/florida-breaks-annual-manatee-death-record_n_60ec23a1e4b07afbc349b64a,Florida Breaks Annual Manatee Death Record In First 6 Months,ENVIRONMENT,"Some biologists believe water pollution is killing seagrass beds, causing manatees to die from starvation.",,2021-07-12
https://www.huffpost.com/entry/tropical-storm-elsa-dead-cuba-caribbean_n_60e14adce4b06fb1a6eb8fb0,"3 Dead As Tropical Storm Elsa Barrels Through Caribbean, Heads For Cuba",ENVIRONMENT,Elsa battered southern coasts of Haiti and the Dominican Republic as Florida Gov. declares state of emergency in 15 counties.,"Danica Coto  and Evens Sanon, AP",2021-07-04
https://www.huffpost.com/entry/texans-conserve-energy-power-grid-struggles_n_60c7c8b1e4b0e25921b6ccdd,Texans Asked To Conserve Energy As Main Power Grid Struggles To Keep Up,ENVIRONMENT,Grid operator ERCOT came under fire earlier this year for dangerous power outages that left millions without electricity and hundreds dead.,Sanjana Karanth,2021-06-14
https://www.huffpost.com/entry/ring-of-fire-eclipse_n_60bba4bee4b0ea8a191ef90f,A 'Ring Of Fire' Eclipse Will Blaze Across The Sky This Week,ENVIRONMENT,An annular solar eclipse will dazzle viewers in some parts of the world.,Hilary Hanson,2021-06-05
https://www.huffpost.com/entry/biden-endangered-species-protections_n_60bbc669e4b0b297f1bb9a47,Biden Moves To Restore Endangered Species Protections Eroded By Trump,ENVIRONMENT,"Under Trump, several protections for threatened species were weakened. The Biden administration said it's now canceling or reviewing these actions.",,2021-06-05
https://www.huffpost.com/entry/chocolate-frog-new-species_n_60bbcd90e4b099fb31c8a9e4,New (And Very Cute) 'Chocolate Frog' Species Identified By Scientists,ENVIRONMENT,"The little frog, Litoria mira, was found in a rainforest swamp in New Guinea.",Hilary Hanson,2021-06-05
https://www.huffpost.com/entry/prince-killed-bear-romania-arthur_n_60969f67e4b0b37f8949a6b2,Austrian Prince Accused Of Illegally Killing Bear Named Arthur In Romania,ENVIRONMENT,"Prince Emanuel von und zu Liechtenstein got a permit to hunt a ""problematic"" bear, but allegedly killed Arthur instead.","Stephen McGrath, AP",2021-05-08
https://www.huffpost.com/entry/biden-earth-day-climate-summit_n_60805abbe4b0c1b896440cee,5 Things To Watch For At Biden’s Big Earth Day Climate Summit,ENVIRONMENT,"As 40 top world leaders gather online for the first big climate confab since 2019, here are the key policies and political dynamics for which to keep an eye out.",Alexander C. Kaufman,2021-04-21
https://www.huffpost.com/entry/bolsonaro-biden-climate-change-brazil_n_60809b36e4b082bab007bb60,Brazil Is Key To Biden's Global Climate Ambitions. The Only Problem? Bolsonaro.,ENVIRONMENT,"As the U.S. gathers world leaders to discuss big climate actions, it's holding out hope it can get Brazil's far-right president to care about deforestation.",Travis Waldron,2021-04-21
https://www.huffpost.com/entry/bears-mystery-disease-friendly_n_6068d1d7c5b68872efe7485f,Bears Are Acting Like Friendly Dogs Due To A Strange Brain Condition,ENVIRONMENT,"Unfortunately, the mysterious ailment has other tragic and life-threatening symptoms.",Hilary Hanson,2021-04-03
https://www.huffpost.com/entry/monarch-butterflies-mexico-population_n_603a8162c5b6d7794adf500d,Monarch Butterfly Population In Mexico Drops By More Than A Quarter,ENVIRONMENT,Monarch butterflies migrating to Mexico's forests for the winter are down by 26% since last year.,,2021-02-27
https://www.huffpost.com/entry/climate-change-biden-cabinet_n_5fde95a3c5b607e6348b326e,"Biden Introduces His Climate Team, Says 'No Time To Waste'",ENVIRONMENT,The incoming Biden team will try to undo or block many of the Trump administration’s initiatives.,"Kevin Freking, AP",2020-12-20
https://www.huffpost.com/entry/gorilla-bird_n_5fb656e8c5b6f00bd84dbfe7,Gorilla Tends To Injured Bird In Heart-Melting Display Of Kindness,ENVIRONMENT,"""How awesome was that?"" exclaimed an observer.",Ron Dicker,2020-11-19
https://www.huffpost.com/entry/walrus-haulout-arctic-circle-kara-sea_n_5fa5744ac5b6f21920dad2aa,Russian Scientists Discover Huge Walrus Haulout In Arctic Circle,ENVIRONMENT,"More than 3,000 walruses have been counted at the remote location on the shores of the Kara Sea","Maria Vasilyeva, Reuters",2020-11-06
https://www.huffpost.com/entry/david-attenborough-covid-19-excesses-capitalism_n_5f81e2f8c5b6e6d033a3302d,David Attenborough Calls Out The 'Excesses' Of Capitalism In A World Facing Climate Change,ENVIRONMENT,"""There should be no dominant nation on this planet,"" the storied broadcaster said.",Jeremy Blum,2020-10-10
https://www.huffpost.com/entry/doc-antle-tiger-king-indicted_n_5f80be81c5b62f97bac268bf,"Doc Antle Of 'Tiger King' Indicted On Animal Cruelty, Wildlife Trafficking Charges",ENVIRONMENT,"Bhagavan 'Doc' Antle, owner of South Carolina's Myrtle Beach Safari, is accused of trafficking lion cubs and multiple animal cruelty counts.","Denise Lavoie, AP",2020-10-09
https://www.huffpost.com/entry/nemonte-nenquimo-indigenous-activist-time-influential-people_n_5f764ddbc5b66377b27f8cac,Time’s Most Influential Indigenous Activist: ‘Capitalism Destroys The Whole Planet’,ENVIRONMENT,"Nemonte Nenquimo, lauded by Leonardo DiCaprio for her work protecting Ecuador's Amazon, speaks about her life, activism and motherhood.",Desirée Yépez,2020-10-04
https://www.huffpost.com/entry/2020-comedy-wildlife-photography-finalists-funny-animal-contest_n_5f5a6f5fc5b62874bc1a0eca,The 2020 Comedy Wildlife Photography Finalists Are Delightfully Seal-y,ENVIRONMENT,Press paws on the news cycle and chuckle at these hilarious photos of animals.,Elyse Wanshel,2020-09-10
https://www.huffpost.com/entry/same-sex-penguins-spain_n_5f4592a9c5b6cf66b2afd55c,Female Penguins Become New Moms After Adopting Egg Together,ENVIRONMENT,"Same-sex couple Electra and Viola, a pair of gentoo penguins, are raising their chick at the Oceanogràfic València aquarium in Spain.",Josephine Harvey,2020-08-26
https://www.huffpost.com/entry/bear-encounter-advice-friends_n_5f30c9bec5b6b9cff7f3be60,"Friends Don't Sacrifice Friends To Bears, Wild National Park Service Message Warns",ENVIRONMENT,"The quirky bear advice also reminds hikers that bruins like to be left alone: ""Don't we all?""",Mary Papenfuss,2020-08-10
https://www.huffpost.com/entry/siberian-heatwave-fires_n_5f1c433dc5b6f2f6c9f725b7,Wildfires Scorch The Arctic As Siberian Heatwave Rages,ENVIRONMENT,Exceptionally hot temperatures are melting sea ice off Russia's Arctic coast and fueling massive fires.,,2020-07-25
https://www.huffpost.com/entry/right-whales-critically-endangered_n_5f08e80dc5b67a80bc076e78,"North Atlantic Right Whales 'One Step From Extinction,' Report Warns",ENVIRONMENT,The whales are newly listed as critically endangered by the International Union for Conservation of Nature.,Hilary Hanson,2020-07-11
https://www.huffpost.com/entry/utilities-charitable-giving-detroit-influence_n_5efe2da6c5b6ca97091b313b,How Utility Companies Use Charitable Giving To Influence Policy,ENVIRONMENT,"The nation’s 10 largest utilities spent about $1 billion on charitable giving from 2013 to 2017, a move critics say is meant to shape policy decisions.",Tom Perkins,2020-07-06
